news_url,image_url,title,text,source_name,date,topics,sentiment,type,tickers
https://investorplace.com/2023/12/3-of-the-best-meme-stocks-to-double-down-on-in-2024/,https://cdn.snapi.dev/images/v1/o/l/tech-stocks-1600-2200927.png,"3 of the Best Meme Stocks to Double Down On in 2024","In the dynamic stock market realm, the term “best meme stocks” transcends being a mere catchphrase, encapsulating a pivotal movement. Fueled by social sentiment, the recent documentary “Dumb Money” shed light on the remarkable retail trading surge of 2021, which left Wall Street pundits scratching their heads.",InvestorPlace,"Mon, 18 Dec 2023 16:21:13 -0500",NAN,Positive,Article,"AMD,META,NVDA"
https://invezz.com/news/2023/12/18/amazon-in-talks-to-invest-in-diamond-sports/?utm_source=snapi,https://cdn.snapi.dev/images/v1/z/l/thibault-penin-chj-lfpj5vq-unsplash-1-scaled-2200917.jpg,"Amazon is reportedly in talks to invest in a bankrupt company","Amazon.com Inc (NASDAQ: AMZN) is in focus on Monday following a report that it plans on investing in Diamond Sports Group. What's in it for Amazon?",Invezz,"Mon, 18 Dec 2023 16:20:05 -0500",NAN,Positive,Article,AMZN
https://www.pymnts.com/apple/2023/lawmakers-question-apples-limits-on-android-access-to-imessage/?utm_source=snapi,https://cdn.snapi.dev/images/v1/a/p/applejpgw457-2200906.jpg,"Lawmakers Question Apple's Limits on Android Access to iMessage","A group of bipartisan lawmakers has called for a probe into whether Apple violated antitrust laws by shutting down third-party applications that enabled Android devices to use the Apple's iMessage service.  This move by Apple has sparked a debate about competition, consumer choice and the future of interoperable messaging services, Bloomberg reported Monday (Dec. 18).",PYMNTS,"Mon, 18 Dec 2023 16:16:30 -0500",NAN,Negative,Article,AAPL
https://www.youtube.com/watch?v=aEG5M_103Lc,https://cdn.snapi.dev/images/v1/z/s/apple-to-halt-us-sales-of-latest-watches-2200924.jpg,"Apple to Halt US Sales of Latest Watches","Apple will stop selling the latest versions of its smartwatch in the US due to a patent dispute, taking the devices off the market in the middle of the busy holiday season. Bloomberg Intelligence's Anurag Rana discusses the announcement with Caroline Hyde and Ed Ludlow on ""Bloomberg Technology.","Bloomberg Technology","Mon, 18 Dec 2023 16:16:13 -0500",product,Negative,Video,AAPL
https://investorplace.com/2023/12/3-ai-stocks-poised-for-explosive-growth-in-2024/,https://cdn.snapi.dev/images/v1/d/7/ai-stocks1600-5-2200824.png,"3 AI Stocks Poised for Explosive Growth in 2024","Businesses and consumers have used artificial intelligence (AI) before 2023, but ChatGPT's launch thrust the technology into the spotlight. Many AI stocks led the stock market and outperformed major indices.",InvestorPlace,"Mon, 18 Dec 2023 15:55:59 -0500",NAN,Positive,Article,"ACLS,ACMR, NVDA"
https://www.businesswire.com/news/home/20231218138223/en/Approov-Identifies-and-Addresses-Apple-Watch-Security-Issues/,https://cdn.snapi.dev/images/v1/z/0/press20-2200821.jpg,"Approov Identifies and Addresses Apple Watch Security Issues","PALO ALTO, Calif. & EDINBURGH, Scotland--(BUSINESS WIRE)-- #AppleWatch--Approov, the leader in mobile security, today revealed new data indicating that watches, wearables and new devices are now the weakest link in the mobile app threat landscape. Key findings include: Watches and other wearables now communicate directly with backend APIs and services. An Apple Watch “zero-day” vulnerability was uncovered in September 2023. Unless protected, watches and wearables will become a rich attack vector for hackers.","Business Wire","Mon, 18 Dec 2023 15:54:00 -0500","PressRelease",Neutral,Article,AAPL
https://www.pymnts.com/subscriptions/2023/apple-adds-subscription-bundle-pricing-developers-competition-heats-up/?utm_source=snapi,https://cdn.snapi.dev/images/v1/a/p/apple-app-storejpgw457-2200872.jpg,"Apple Adds Subscription Bundle Pricing for Developers as Competition Heats Up","As app developers look to drive subscription loyalty in the face of increasing competition, Apple is making it possible for players in the space to offer bundled subscription pricing. The tech giant announced Friday (Dec. 15) in a post on its site for developers that it is testing the feature.",PYMNTS,"Mon, 18 Dec 2023 15:51:19 -0500",NAN,Positive,Article,AAPL
https://www.youtube.com/watch?v=3tPdW01phB8,https://cdn.snapi.dev/images/v1/t/r/how-amazon-is-tackling-generative-ai-2200819.jpg,"How Amazon Is Tackling Generative AI","Amazon Web Services Vice President Mai-Lan Tomsen Bukovec shares what's top of mind for the c-suite executives with generative AI right now, what challenges they're facing and what's ahead in 2024. She speaks with Ed Ludlow and Caroline Hyde on Bloomberg Technology.","Bloomberg Technology","Mon, 18 Dec 2023 15:44:24 -0500",NAN,Positive,Video,AMZN
https://techxplore.com/news/2023-12-apple-sale-latest-patent-clash.html,https://cdn.snapi.dev/images/v1/1/q/apple-hitting-pause-on-2200798.jpg,"Apple pauses US sale of latest Watch models over patent clash","Apple on Monday said it will stop selling some of its smartwatch models in the United States while it fights a patent battle over technology for detecting blood oxygen levels.",TechXplore,"Mon, 18 Dec 2023 15:38:59 -0500",NAN,Negative,Article,AAPL
https://www.fool.com/investing/2023/12/18/amazon-set-a-new-52-week-high-is-the-stock-a-buy-n/,https://cdn.snapi.dev/images/v1/l/b/10amescg-1-2200790.jpg,"Amazon Set a New 52-Week High: Is the Stock a Buy Now?","One analyst called Amazon its top megacap pick for 2024. The stock has been surging since it reported strong third-quarter results.","The Motley Fool","Mon, 18 Dec 2023 15:16:00 -0500",NAN,Positive,Article,AMZN
https://nypost.com/2023/12/18/media/amazon-in-talks-to-invest-in-diamond-sports-report/,https://cdn.snapi.dev/images/v1/g/r/gr3rf-2201022.jpg,"Amazon eyes bankrupt Diamond Sports in push to stream MLB, NBA, NHL: report","If an agreement is reached, Amazon's Prime Video platform would eventually become the streaming home for Diamond's games, the Wall Street Journal reported.","New York Post","Mon, 18 Dec 2023 15:13:35 -0500",NAN,Positive,Article,AMZN
https://www.fool.com/investing/2023/12/18/why-alphabet-amazon-and-other-magnificent-seven-st/,https://cdn.snapi.dev/images/v1/g/g/urlhttps3a2f2fgfoolcdncom2feditorial2fimages2f7586902fa-person-comparing-charts-on-a-computer-with-graphs-on-paperjpgopresizew400h400-2200780.jpg,"Why Alphabet, Amazon, and Other ""Magnificent Seven"" Stocks Rallied Today","The so-called ""Magnificent Seven"" stocks have rallied this year, primarily fueled by their connection to artificial intelligence (AI). That, combined with improving financial and economic conditions, should drive additional gains in 2024.","The Motley Fool","Mon, 18 Dec 2023 14:56:51 -0500",NAN,Positive,Article,"AMZN,GOOG,GOOGL,META"
https://nypost.com/2023/12/18/business/lawmakers-ask-doj-to-probe-apple-after-it-shut-down-imessage-app-on-android/,https://cdn.snapi.dev/images/v1/a/4/lawmakers-ask-doj-probe-apple-73907891jpgquality90stripall-2200768.jpg,"Lawmakers ask DOJ for antitrust probe of Apple for shutting down iMessage on Android","A bipartisan group of four US senators and representatives asked the Department of Justice whether Apple violated antitrust laws for shutting down an application that enabled Android devices to text iPhone users via iMessage.","New York Post","Mon, 18 Dec 2023 14:48:17 -0500",NAN,Negative,Article,AAPL
https://www.fool.com/investing/2023/12/18/why-costco-rallied-today/,https://cdn.snapi.dev/images/v1/q/y/cost6-2200770.jpg,"Why Costco Rallied Today","A Wall Street analyst upgraded the stock today. Investors may be piling in ahead of the upcoming $15 special dividend.","The Motley Fool","Mon, 18 Dec 2023 14:42:38 -0500",NAN,Positive,Article,COST
https://www.youtube.com/watch?v=KQ5ge3MjZls,https://cdn.snapi.dev/images/v1/b/a/ives-expect-apple-to-have-a-4-trillion-market-cap-next-year-2200755.jpg,"Ives: Expect Apple to have a $4 trillion market cap next year","Dan Ives, Senior Equity Analyst at Wedbush Securities, joins Bloomberg Radio and reacts to Apple's new they will halt watch sales.","Bloomberg Markets and Finance","Mon, 18 Dec 2023 14:32:10 -0500",NAN,Positive,Video,AAPL
https://www.marketwatch.com/story/amazon-in-talks-to-invest-in-diamond-sports-group-report-d69c3aa0,https://cdn.snapi.dev/images/v1/z/a/gettyimages-954304196jpgw651-2200750.jpg,"Amazon in talks to invest in Diamond Sports Group: report","Amazon.com Inc. AMZN, +2.93% is in talks to invest in Diamond Sports Group, which carries the games of more than 40 major sports teams nationwide but filed for bankruptcy this year, according to a Wall Street Journal report Monday. The move would be among the boldest Amazon has pursued yet into sports content as it takes on streaming rivals Walt Disney Co. DIS, -0.67% and Netflix Inc. NFLX, +2.92%.","Market Watch","Mon, 18 Dec 2023 14:32:00 -0500",paylimitwall,Positive,Article,AMZN
https://www.zacks.com/stock/news/2199579/meta-platforms-meta-is-an-incredible-growth-stock-3-reasons-why,https://cdn.snapi.dev/images/v1/q/4/default43-2200731.jpg,"Meta Platforms (META) is an Incredible Growth Stock: 3 Reasons Why","Meta Platforms (META) possesses solid growth attributes, which could help it handily outperform the market.","Zacks Investment Research","Mon, 18 Dec 2023 14:17:09 -0500",NAN,Positive,Article,META
https://www.nytimes.com/2023/12/18/technology/apple-ban-watch-sales-patent-dispute.html,https://cdn.snapi.dev/images/v1/u/c/appl2-2200725.jpg,"Apple to Pause Selling New Versions of Its Watch After Losing Patent Dispute","The move, which comes after a ruling by the International Trade Commission, could create a run on watch sales in the week before Christmas.",NYTimes,"Mon, 18 Dec 2023 14:12:16 -0500",paywall,Negative,Article,AAPL
https://www.marketwatch.com/story/apple-will-reach-a-milestone-by-the-end-of-next-year-analyst-says-34218620,https://cdn.snapi.dev/images/v1/a/m/im-851024size1777777777777778width800-2200720.jpg,"Apple will reach a milestone by the end of next year,analyst says","Apple Inc. will hit a major milestone by the end of next year, boosted by the tech giant's performance in China, according to Wedbush analyst Dan Ives.","Market Watch","Mon, 18 Dec 2023 14:06:00 -0500",paylimitwall,Positive,Article,AAPL
https://www.seeitmarket.com/3-investor-datapoints-to-watch-snapchat-google-gemini-and-apartment-rents/,https://cdn.snapi.dev/images/v1/n/8/urlhttps3a2f2fgfoolcdncom2feditorial2fimages2f7404062fmobile-stock-tradingjpgopresizew400h400-1995799-2188482-2200701.jpg,"3 Investor Datapoints To Watch: Snapchat, Google Gemini, and Apartment Rents","Today we take a look at a broad swath of economic data, from technology numbers to apartment rent costs. Below is a summary of our 3 data points for today's discussion: Overall There are so many things to bring up this week that incorporate data.","See It Market","Mon, 18 Dec 2023 13:46:07 -0500",NAN,Neutral,Article,"GOOG,GOOGL,SNAP"
https://www.businessinsider.com/apple-halting-sales-series-9-ultra-2-watch-united-states-2023-12,https://cdn.snapi.dev/images/v1/6/5/658082fda79e5746976a89c5formatjpeg-2200686.jpg,"Apple will stop selling the newest versions of the Apple Watch in the US this week unless President Biden intervenes","Apple announced it would stop selling two models of the Apple Watch later this week. This follows a patent dispute judgment by the ITC over the watch's blood oxygen monitor.","Business Insider","Mon, 18 Dec 2023 13:27:52 -0500","paywall",Negative,Article,AAPL
https://investorplace.com/2023/12/3-blue-chip-stocks-youll-regret-not-buying-soon-december-edition/,https://cdn.snapi.dev/images/v1/h/k/blue-chip-words-2200650.jpg,"3 Blue-Chip Stocks You'll Regret Not Buying Soon: December Edition","Christmas has come early on Wall Street thanks to the U.S. Federal Reserve. The central bank's last interest rate decision of 2023 delivered everything investors wanted to hear.",InvestorPlace,"Mon, 18 Dec 2023 13:24:06 -0500",NAN,Positive,Article,"COST,DRI,LEN"
https://www.cnet.com/tech/mobile/apple-watch-series-9-and-ultra-2-sales-are-pausing-in-the-us-what-to-know/,https://cdn.snapi.dev/images/v1/a/p/apple-watch-series-9-13jpgautowebpfitcropheight675width1200-2200641.jpg,"Apple Watch Series 9 and Ultra 2 Sales Are Pausing in the US: What to Know","You have until Dec. 24 to get a Series 9 or Ultra 2, but the Apple Watch SE is unaffected.",CNET,"Mon, 18 Dec 2023 13:01:37 -0500",product,Negative,Article,AAPL
https://www.theguardian.com/technology/2023/dec/18/apple-watch-sales-pause-patent-dispute,https://cdn.snapi.dev/images/v1/6/1/6141jpgwidth460quality85autoformatfitmaxs29ae02c355584e9ebdb8aeba8d83b428-2200639.jpg,"Apple pauses US sales of two watch models over patent dispute","Sales of Series 9 and Ultra 2 watches affected amid dispute with Masimo over technology behind blood oxygen feature","The Guardian","Mon, 18 Dec 2023 12:47:44 -0500",NAN,Negative,Article,AAPL
https://www.pymnts.com/apple/2023/apple-halt-sales-2-smartwatches-amid-patent-dispute/?utm_source=snapi,https://cdn.snapi.dev/images/v1/a/p/apple-watchjpgw457-2200579.jpg,"Apple to Halt Sales of 2 Smartwatches Amid Patent Dispute","Apple is set to halt sales of two models of its smartwatch in the coming days as the company prepares to comply with a U.S. import ban related to a patent dispute.",PYMNTS,"Mon, 18 Dec 2023 12:43:38 -0500",NAN,Negative,Article,AAPL
https://www.proactiveinvestors.com/companies/news/1036529?SNAPI,https://cdn.snapi.dev/images/v1/q/u/2023-12-18-12-28-02-db6c946977f5bc2aa9948b59e49b55e1-2200553.jpg,"Apple halts US sales of Series 9 and Ultra 2 Apple watches amid ITC ban","Apple Inc (NASDAQ:AAPL) will cease selling the Apple Watch Series 9 and Ultra 2 models in the US from December 21st, complying with a US International Trade Commission (ITC) import ban following a patent dispute with medical device maker Masimo over its SpO2 sensor. The ban, affecting only the flagship Series 9 and Ultra 2 models, won't impact the Apple Watch SE or previous models without the blood oxygen sensor.","Proactive Investors","Mon, 18 Dec 2023 12:28:58 -0500",product,Negative,Article,AAPL
https://www.businessinsider.com/tesla-union-dispute-sweden-could-morph-into-a-brush-fire-2023-12,https://cdn.snapi.dev/images/v1/6/5/6580732b50edbc52a8653c6dformatjpeg-2200570.jpg,"Tesla's growing union dispute could morph into a 'brush fire'","The next union battleground could be Tesla. How Tesla responds to labor disputes in Scandinavia could shape talks with UAW.","Business Insider","Mon, 18 Dec 2023 12:18:16 -0500",paylimitwall,Negative,Article,TSLA
https://www.youtube.com/watch?v=qB8AMW_FZWk,https://cdn.snapi.dev/images/v1/r/i/microsoft-positioned-the-best-to-drive-ai-adoption-2200544.jpg,"Microsoft 'positioned the best' to drive AI adoption","As Microsoft (MSFT) broadens its AI reach through partnerships like OpenAI while advancing in-house offerings such as Copilot, Macquarie's Head of AI & Software Research Fred Havemeyer joins Yahoo Finance Live to discuss why he sees Microsoft shares as undervalued given its generative AI potential. Havemeyer believes the revenue and profit opportunities for Microsoft in this space are significant.","Yahoo Finance","Mon, 18 Dec 2023 12:06:14 -0500",NAN,Positive,Video,MSFT
https://www.cnbc.com/2023/12/18/apple-to-pause-some-apple-watch-sales-after-intellectual-property-dispute.html,https://cdn.snapi.dev/images/v1/d/h/107305560-1695475175036-gettyimages-1683464846-aa-23092023-1352153-2200539.jpeg,"Apple to pause some Apple Watch sales after intellectual property dispute","The decision stems from an intellectual property disagreement between Apple and Masimo over the Blood Oxygen feature.",CNBC,"Mon, 18 Dec 2023 12:01:43 -0500",product,Negative,Article,AAPL
https://www.pymnts.com/streaming/2023/amazon-nails-down-partnership-with-warhammer-creator/?utm_source=snapi,https://cdn.snapi.dev/images/v1/a/m/amazon-warhammerjpgw457-2200568.jpg,"Amazon Nails Down Partnership With Warhammer Creator","Amazon has agreed to develop movies and TV series based on the Warhammer 40,000 games. Games Workshop, the British company that makes the miniature tabletop game series, announced the agreement on its website Monday (Dec. 18).",PYMNTS,"Mon, 18 Dec 2023 12:01:41 -0500",NAN,Positive,Article,"AMZN,GMWKF"
https://www.barrons.com/articles/apple-stock-watch-import-ban-e39d8ac4,https://cdn.snapi.dev/images/v1/r/q/ukfgwhr2cjikthxy6loigseivq-2198968-2200525.jpg,"Apple Stock Falls on Reports Watch Sales Will Be Halted","The ban will include the Apple Watch Series 9 and Apple Watch Ultra 2, according to reports.",Barrons,"Mon, 18 Dec 2023 11:48:00 -0500","paywall",Negative,Article,AAPL
https://nypost.com/2023/12/18/business/apple-halting-us-sales-of-series-9-ultra-2-smartwatches-over-patent-dispute/,https://cdn.snapi.dev/images/v1/5/q/apple-itc-ruling-watchesjpgquality90stripall1702897150-2200505.jpg,"Apple halting US sales of Series 9, Ultra 2 smartwatches over blood-oxygen patent dispute","The move comes after an order in October from the US International Trade Commission that could bar Apple from importing its Apple Watches after finding the devices violate medical technology company Masimo's patent rights.","New York Post","Mon, 18 Dec 2023 11:35:23 -0500",NAN,Negative,Article,AAPL
https://www.fool.com/investing/2023/12/18/potential-ai-stock-split-stocks-keep-eye-new-year/,https://cdn.snapi.dev/images/v1/u/r/urlhttps3a2f2fgfoolcdncom2feditorial2fimages2f7584902fartificial-intelligence-ai-robot-big-data-bull-market-stock-chart-gettyjpgopresizew400h400-2200564.jpg,"2 Potential AI Stock-Split Stocks to Keep an Eye On in the New Year","Stock splits don't change the fundamentals of a stock, but there's some evidence that they're correlated with strong returns. Broadcom has doubled this year and is seeing strong demand for generative AI products.","The Motley Fool","Mon, 18 Dec 2023 11:31:40 -0500",NAN,Positive,Article,"AVGO,NVDA"
https://www.reuters.com/technology/apple-halt-sales-some-apple-watches-us-2023-12-18/,https://cdn.snapi.dev/images/v1/e/2/e2wed-2200614.jpg,"Apple to halt US sales of Series 9, Ultra 2 smartwatches over patent dispute","Apple said on Monday it would pause sales of its Series 9 and Ultra 2 smartwatches in the United States from this week, as it deals with a patent dispute over the technology that enables the blood oxygen feature on the devices.",Reuters,"Mon, 18 Dec 2023 11:18:00 -0500",NAN,Negative,Article,AAPL
https://finbold.com/nvidia-is-the-cheapest-big-tech-stock-despite-250-surge-heres-how/?utm_source=snapi,https://cdn.snapi.dev/images/v1/3/3/nvidia-is-the-cheapest-big-tech-stock-despite-250-surge-heres-how-2200449.jpg,"Nvidia is the cheapest Big Tech stock despite 250% surge; Here's how","Nvidia (NASDAQ: NVDA) has emerged as a dominant force in the 2023 stock market, riding the wave of the tech revolution led by artificial intelligence (AI).",Finbold,"Mon, 18 Dec 2023 11:15:55 -0500",NAN,Positive,Article,NVDA
https://www.fool.com/investing/2023/12/18/1-best-metaverse-stock-to-buy-in-2023-and-beyond/,https://cdn.snapi.dev/images/v1/o/p/mw-hu061-facebo-20191025172424-zhjpguuidd0f478d0-f76d-11e9-b6c4-9c8e992d421e-2200482.jpg,"1 Best Metaverse Stock to Buy in 2023 and Beyond","Meta Platforms' Reality Labs division is posting billions in operating losses each quarter. Mark Zuckerberg's strategic thinking for investing in the metaverse makes sense.","The Motley Fool","Mon, 18 Dec 2023 11:15:00 -0500",NAN,Positive,Article,META
https://stockmarket.com/featured/3-airline-stocks-to-watch-in-mid-december-2023-2023-12-18,https://cdn.snapi.dev/images/v1/c/y/airline-stocks-1024x576-2200430.jpg,"3 Airline Stocks To Watch In Mid-December 2023","3 airline stocks to check out in the stock market today.",Stockmarketcom,"Mon, 18 Dec 2023 11:12:42 -0500",StocksToWatch,Positive,Article,"AAL,DAL,UAL"
https://www.investors.com/research/how-to-find-the-best-stocks-to-buy/nvidia-stock-amazon-add-nitro-to-supersize-ai-power-breakouts/,https://cdn.snapi.dev/images/v1/u/r/urlhttps3a2f2fgfoolcdncom2feditorial2fimages2f7581342fanalyst-smiling-and-looking-at-laptopjpgopresizew400h400-2199149-2200561.jpg,"Two Magnificent Seven Behemoths Add 'Nitro' To Supersize AI, Power Breakouts","To fuel even more generative AI innovations, Nvidia stock and Amazon have teamed up to add some 'Nitro' to their recent breakouts.","Investors Business Daily","Mon, 18 Dec 2023 11:12:26 -0500",paywall,Positive,Article,"AMZN,NVDA"
https://seekingalpha.com/article/4658461-tesla-cost-cutting-pressure-will-continue-to-rise-due-to-china,https://cdn.snapi.dev/images/v1/w/v/image-1311107789-2200492.jpg,"Tesla: Cost-Cutting Pressure Will Continue To Rise Due To China","There is massive cost pressure on EVs in order to boost demand and to compete effectively with low-priced Chinese exports. There has been a “flood” of Chinese EVs in the European market, and they have gained 8% share of EVs sold with possible increase to 15% by 2025. Tesla has been forced to make a number of price cuts in 2023 which has reduced operating margin from 17.2% in the year-ago quarter to only 7.5% in the recent.","Seeking Alpha","Mon, 18 Dec 2023 11:07:35 -0500",paylimitwall,Negative,Article,TSLA
https://www.marketwatch.com/story/apples-stock-falls-after-wsj-report-that-apple-watch-sales-will-be-halted-d4d59d1b,https://cdn.snapi.dev/images/v1/j/r/apple-1-2-2200394.jpg,"Apple's stock falls after WSJ report that Apple Watch sales will be halted","Shares of Apple Inc. AAPL, -1.33% dropped 1.4% in morning trading Monday, after The Wall Street Journal reported the technology giant was set to halt Apple Watch sales in a preemptive move to comply with a U.S. import ban regarding use of blood-oxygen sensors. The ban, which would include the Apple Watch Series 9 and Apple Watch Ultra 2, comes after the U.S. International Trade Commission found that Apple violated patents in most new models of its smartwatches since 2020, the WSJ report said.","Market Watch","Mon, 18 Dec 2023 10:57:00 -0500","paylimitwall",Negative,Article,AAPL
https://www.fool.com/investing/2023/12/18/will-intel-stock-dominate-the-artificial-intellige/,https://cdn.snapi.dev/images/v1/r/m/podc13-2200399.jpg,"Will Intel Stock Dominate the Artificial Intelligence (AI) PC Market?","Intel's new consumer CPUs are meant to bring AI technology to consumer products.","The Motley Fool","Mon, 18 Dec 2023 10:55:47 -0500",podcast,Positive,Article,INTC
https://www.forbes.com/sites/jamesfarrell/2023/12/18/apple-halts-sale-of-watch-series-9-and-ultra-2-over-patent-dispute/,https://cdn.snapi.dev/images/v1/x/o/apple-halts-sale-of-watch-series-9-and-ultra-2-over-patent-dispute-2200393.jpg,"Apple Halts Sale Of Watch Series 9 And Ultra 2 Over Patent Dispute","Apple will halt sales of its Apple Watch Series 9 and Apple Watch Ultra 2 just days before Christmas due to a patent dispute with medical technology company Masimo over a blood oxygen monitor included in both models, multiple media outlets are reporting.",Forbes,"Mon, 18 Dec 2023 10:53:33 -0500",paylimitwall,Negative,Article,AAPL
https://techcrunch.com/2023/12/18/u-s-lawmakers-call-for-doj-to-investigate-apple-for-blocking-beepers-imessage-app/,https://cdn.snapi.dev/images/v1/b/e/beeper-mini-ui-2200377.jpg,"U.S. lawmakers call for DoJ to investigate Apple for blocking Beeper's iMessage app","Apple's move to cut off Beeper, the app that brought iMessage to Android users, already caught the attention of U.S. Senator Elizabeth Warren who called out the tech giant for anticompetitive behavior. Now, a bipartisan group of U.S. lawmakers is asking the U.S.",TechCrunch,"Mon, 18 Dec 2023 10:46:16 -0500",NAN,Positive,Article,AAPL
https://www.fool.com/investing/2023/12/18/nvidia-and-amds-artificial-intelligence-ai-battle/,https://cdn.snapi.dev/images/v1/p/o/podc11-2200426.jpg,"Nvidia and AMD's Artificial Intelligence (AI) Battle Is Heating Up","Advanced Micro Devices' MI300X and Nvidia's H100 are facing off for the top AI chip spot.","The Motley Fool","Mon, 18 Dec 2023 10:45:13 -0500",podcast,Positive,Article,"AMD,NVDA"
https://www.reuters.com/business/autos-transportation/swedes-support-tesla-mechanics-strike-poll-shows-2023-12-18/,https://cdn.snapi.dev/images/v1/3/d/3dssss-2200503.jpg,"Swedes support Tesla mechanics' strike, poll shows","Most Swedes support an ongoing mechanics strike at Tesla's workshops in the Nordic country over the right to collective bargaining, an opinion poll by Novus showed.",Reuters,"Mon, 18 Dec 2023 10:36:00 -0500",NAN,Positive,Article,TSLA
https://www.benzinga.com/trading-ideas/23/12/36284890/apples-trillion-dollar-triumph-navigating-the-highs-lows-and-record-breaking-rise-to-reclaim-its-3?utm_source=snapi,https://cdn.snapi.dev/images/v1/l/a/laurenz-heymann-vkfhjlz5smq-unsplash-2-0-2200421.jpg,"Apple's Trillion-Dollar Triumph - Navigating The Highs, Lows, And Record-Breaking Rise To Reclaim Its $3 Trillion Valuation","Apple Inc. AAPL has continued to show its strength and potential for growth. In 2023 alone, Apple's market capitalization increased by an impressive $1 trillion, reaffirming its status as one of the five US companies valued at over $1 trillion.",Benzinga,"Mon, 18 Dec 2023 10:32:51 -0500",NAN,Positive,Article,AAPL
https://www.zacks.com/stock/news/2199302/4-must-buy-stocks-to-benefit-from-ai-spending-boom-in-2024,https://cdn.snapi.dev/images/v1/x/i/computer-electronic38-2200359.jpg,"4 Must-Buy Stocks to Benefit From AI Spending Boom in 2024","Here, we have presented 4 tech stocks, META, INTC, NVDA and PATH, which are poised to gain from the rise in artificial intelligence spending in 2024.","Zacks Investment Research","Mon, 18 Dec 2023 10:31:53 -0500",NAN,Positive,Article,"INTC,META,NVDA, PATH"
