news_url,image_url,title,text,source_name,date,topics,sentiment,type,tickers
https://www.fool.com/investing/2023/09/12/bull-market-coming-is-it-time-to-revamp-portfolio/,https://cdn.snapi.dev/images/v1/g/u/urlhttps3a2f2fgfoolcdncom2feditorial2fimages2f7472402fhappy-wheelchair-person-workingjpgopresizew400h400-2058873.jpg,"A Bull Market Is Coming: Is It Time to Revamp Your Portfolio?","You may want to add some more growth stocks to your portfolio -- but you should think twice before making major changes to your asset allocations. It's best to establish a long-term investment strategy and stick with it.","The Motley Fool","Tue, 12 Sep 2023 05:30:00 -0400",NAN,Neutral,Article,"AMZN,GOOG,GOOGL"
https://www.businesswire.com/news/home/20230912365077/en/OpenFold-AI-Research-Consortium-Welcomes-Three-New-Members-UCB-NVIDIA-and-Valence-Labs/,https://cdn.snapi.dev/images/v1/3/u/press15-2058875.jpg,"OpenFold AI Research Consortium Welcomes Three New Members: UCB, NVIDIA and Valence Labs","DAVIS, Calif.--(BUSINESS WIRE)--OpenFold aims to use AI to address ‘society's deepest challenges'.","Business Wire","Tue, 12 Sep 2023 05:30:00 -0400",PressRelease,Neutral,Article,NVDA
https://www.youtube.com/watch?v=ATYNUNmFn2E,https://cdn.snapi.dev/images/v1/0/d/nvidia-vs-arm-whats-the-difference-between-the-two-companies-2058874.jpg,"Nvidia vs. Arm: What's the difference between the two companies?","CNBC's Arjun Kharpal breaks down the difference between Arm, which is gearing up for an IPO this week, and chipmaker Nvidia.","CNBC International TV","Tue, 12 Sep 2023 05:26:20 -0400",NAN,Neutral,Video,"NVDA,ARM"
https://www.marketwatch.com/story/oracle-stock-slumps-apple-shares-steady-and-other-stocks-on-the-move-3dc58bb4,https://cdn.snapi.dev/images/v1/r/f/im-850202size1777777777777778width800-2058867.jpg,"Oracle stock slumps, Apple shares steady and other stocks on the move","Apple stock AAPL, +0.66% inched 0.1% higher ahead of the presentation of its new iPhone. The stock has dropped 5% over the last five sessions on China concerns.","Market Watch","Tue, 12 Sep 2023 05:26:00 -0400",paylimitwall,Negative,Article,"AAPL,ORCL"
https://www.fool.com/investing/2023/09/12/ai-artificial-intelligence-growth-stock-buy/,https://cdn.snapi.dev/images/v1/c/a/catalog-mail7-2059137.jpg,"AI Revolution: 2 Artificial Intelligence Growth Stocks Billionaire Investors Are Buying Hand Over Fist","The latest developments in generative AI have been making headlines. Some of the world's most famous hedge fund billionaires have taken notice.","The Motley Fool","Tue, 12 Sep 2023 05:25:00 -0400",NAN,Positive,Article,"AMZN,MSFT"
https://www.reuters.com/business/environment/amazon-makes-first-investment-direct-air-capture-climate-technology-2023-09-12/,https://cdn.snapi.dev/images/v1/s/l/urlhttps3a2f2fgfoolcdncom2feditorial2fimages2f5790702famazon-smilejpgw700opresize-2058860.jpg,"Amazon makes first investment in direct air capture climate technology","E-commerce giant Amazon.com is making its first investment in direct air capture technology, which removes emissions from the atmosphere, by committing to purchase 250,000 tons of removal credits over 10 years, it said on Tuesday.",Reuters,"Tue, 12 Sep 2023 05:05:28 -0400",NAN,Positive,Article,AMZN
https://investorplace.com/2023/09/3-reddit-approved-ai-stocks-for-your-buy-list/,https://cdn.snapi.dev/images/v1/s/b/reddit-1600-2058858.png,"3 Reddit-Approved AI Stocks for Your Buy-List","When it comes to identifying the pulse of contemporary stock market trends, it's tough to overlook the burgeoning influence of Reddit. Investing subreddits in particular have steered notable stock shifts and even reshaped market narratives.",InvestorPlace,"Tue, 12 Sep 2023 05:00:49 -0400",NAN,Positive,Article,"AAPL,META,NVDA"
https://www.marketwatch.com/story/u-s-stock-futures-dip-ahead-of-apple-event-with-inflation-data-looming-8e93ea33,https://cdn.snapi.dev/images/v1/z/n/im-850418size1777777777777778width800-2058848.jpg,"U.S. stock futures dip ahead of Apple event, with inflation data looming","U.S. stock futures were struggling to make headway early Tuesday as traders kept their powder dry ahead of Apple's marketing event later in the session and important inflation and retail sales data in coming days.","Market Watch","Tue, 12 Sep 2023 04:54:00 -0400",paylimitwall,Neutral,Article,AAPL
https://www.fool.com/investing/2023/09/12/top-stocks-to-buy-amazon-stock-vs-alibaba-stock/,https://cdn.snapi.dev/images/v1/p/o/podc1-2059125.jpg,"Top Stocks to Buy: Amazon Stock vs. Alibaba Stock","Amazon and Alibaba are running similar business models in different parts of the world.","The Motley Fool","Tue, 12 Sep 2023 04:45:00 -0400","StocksToWatch",Neutral,Article,"AMZN,BABA"
https://seekingalpha.com/article/4634531-dividend-growth-stock-watchlist-september-2023,https://cdn.snapi.dev/images/v1/i/m/image-1445810122-2059122.jpg,"Dividend Growth Stock Watchlist - September 2023","There are 20 stocks on my dividend growth watchlist for September 2023. About half of the stock on my watchlist are undervalued based on dividend yield theory. An equally weighted portfolio of these stocks would have outperformed the Vanguard Dividend Appreciation ETF by about 1% during the month of August and more than 9% year to date.","Seeking Alpha","Tue, 12 Sep 2023 04:20:29 -0400","paylimitwall",Positive,Article,"AAPL,ACN,AMAT,APH,COST,CTAS,GGG,HD,INTU,JKHY,LOW,MA,MPWR,MSFT,NOC,ROP,SCHW,SHW,TSCO,V,VIG"
https://techxplore.com/news/2023-09-google-landmark-antitrust-trial-1.html,https://cdn.snapi.dev/images/v1/y/u/over-10-weeks-of-testi-2058808.jpg,"US takes on Google in landmark antitrust trial","Google begins a marathon battle in a federal court on Tuesday to fight accusations from the US government that it acted unlawfully to become the world's preeminent search engine.",TechXplore,"Tue, 12 Sep 2023 04:18:54 -0400",NAN,Negative,Article,"GOOG,GOOGL"
https://seekingalpha.com/article/4634525-american-airlines-compressed-valuation-irrational-fears,https://cdn.snapi.dev/images/v1/0/g/image-1440778829-2058841.jpg,"American Airlines: Compressed Valuation Due To Irrational Fears","American Airlines' stock is near yearly lows despite the airline returning to producing massive profits. Higher fuel prices are a concern for the market, but they don't significantly impact the airline's ability to generate substantial profits. The stock is far too cheap trading at only 4.5x EPS targets while industrial transport peers trade at 3x the PE multiple.","Seeking Alpha","Tue, 12 Sep 2023 04:05:35 -0400",paylimitwall,Positive,Article,AAL
https://www.zacks.com/stock/news/2147508/best-etfs-of-last-week-revised,https://cdn.snapi.dev/images/v1/q/t/default7-2058796.jpg,"Best ETFs of Last Week (Revised)","Wall Street delivered downbeat performances last week due to rising rates.","Zacks Investment Research","Tue, 12 Sep 2023 03:49:04 -0400",NAN,Negative,Article,"AAPL,BDRY,CYA,DWSH,HDGE,WEED"
https://www.businesswire.com/news/home/20230912881917/en/DT-Research-Expands-Line-of-Military-Standard-Rugged-Laptops-with-NVIDIA-Graphics/,https://cdn.snapi.dev/images/v1/a/o/press19-2058778.jpg,"DT Research Expands Line of Military Standard Rugged Laptops with NVIDIA Graphics","SAN JOSE, Calif.--(BUSINESS WIRE)--DT Research, the leading designer and manufacturer of purpose-built computing solutions for vertical markets, today announced the expansion of the LT300 line of fully rugged laptops designed for ultimate versatility, durability and reliability in harsh conditions. The LT355 laptop is purpose-built for military, first responder, law enforcement, field service and warehouse environments with IP65, MIL-STD-810G/H ratings, EPEAT certification and TAA compliant. Th.","Business Wire","Tue, 12 Sep 2023 03:00:00 -0400",PressRelease,Neutral,Article,NVDA
https://www.cnbc.com/2023/09/12/arm-ipo-ai-play-in-focus-after-huge-nvidia-rally-.html,https://cdn.snapi.dev/images/v1/g/n/107298383-1694437949412-gettyimages-1231191963-pgonchar-3e9234-2058749.jpeg,"After Nvidia's 200% rally this year, investors look to the Arm IPO — but the two are very different","Softbank, the owner of Arm, and its positioning of the British chip designer as an AI play, ahead of its blockbuster initial public offering (IPO).",CNBC,"Tue, 12 Sep 2023 01:51:06 -0400",NAN,Positive,Article,"ARM,NVDA"
https://www.businesswire.com/news/home/20230911239103/en/Alipay-and-Google-Play-Launch-Initiatives-to-Enhance-Game-Developers-Engagement-with-Asias-Mobile-Users/,https://cdn.snapi.dev/images/v1/p/r/press19-2059212.jpg,"Alipay+ and Google Play Launch Initiatives to Enhance Game Developers' Engagement with Asia's Mobile Users","SINGAPORE--(BUSINESS WIRE)--Alipay+ and Google Play are launching a series of joint initiatives including region-wide tournaments and gaming festivals to help global game developers broaden their outreach to players worldwide and help them capture a larger percentage of this fast-growing industry. Since August 2023, Mobile Legends: Bang Bang (MLBB) has collaborated with Alipay+ and Google Play to host a tournament, open to all local fans in the Philippines and Malaysia with a total prize size o.","Business Wire","Tue, 12 Sep 2023 01:42:00 -0400",PressRelease,Neutral,Article,"GOOG,GOOGL"
https://www.prnewswire.com/news-releases/napatech-launches-5g-user-plane-function-offload-solution-on-its-intel-agilex-fpga-based-400gbps-smartnic-301922673.html,https://cdn.snapi.dev/images/v1/o/t/press12-2058736.jpg,"Napatech launches 5G User Plane Function offload solution on its Intel Agilex® FPGA-based 400Gbps SmartNIC","COPENHAGEN--Denmark--Sept. 12, 2023 /PRNewswire/ -- Napatech (OSLO: NAPA.OL), a leading provider of programmable Smart Network Interface Cards (SmartNICs) and Infrastructure Processing Units (IPU) used in cloud, enterprise and telecom datacenter networks today announced the availability of its offload solution for 5G User Plane Function (UPF) on the new NT400 400Gbps SmartNIC which leverages the latest Intel Agilex® FPGA.",PRNewsWire,"Tue, 12 Sep 2023 01:00:00 -0400",PressRelease,Neutral,Article,INTC
https://www.zacks.com/stock/news/2147502/electric-vehicles-artificial-intelligence-is-it-time-to-buy-tesla-s-stock,https://cdn.snapi.dev/images/v1/5/a/4142-2058733.jpg,"Electric Vehicles & Artificial Intelligence, is it Time to Buy Tesla's Stock?","Shares of Tesla soared +10% on Monday primarily attributed to an upgrade from Morgan Stanley (MS), who raised their price target for the EV pioneer's stock to $400 a share.","Zacks Investment Research","Tue, 12 Sep 2023 00:46:04 -0400",NAN,Positive,Article,TSLA
https://www.reuters.com/business/autos-transportation/tesla-suppliers-invest-15-bln-mexico-factory-local-governor-2023-09-12/,https://cdn.snapi.dev/images/v1/t/y/gkbi6cz7z5kmjhrkvprbcqow7i-2058717.jpg,"Tesla, suppliers to invest $15 bln in Mexico factory - local governor","A state governor in Mexico said on Monday that Tesla and its suppliers would invest $15 billion over the next two years in a factory that is still under construction, an amount that is triple what Mexican officials previously announced.",Reuters,"Mon, 11 Sep 2023 23:24:28 -0400",NAN,Positive,Article,TSLA
https://247wallst.com/investing/2023/09/11/meta-stock-forecast-pioneer-to-new-heights/,https://cdn.snapi.dev/images/v1/t/x/sized-facebook-metajpgquality90stripall-1082548-2058703.jpg,"META Stock Forecast: Pioneer to New Heights","A financial advisor can help you understand the advantages and disadvantages of investment properties.","24/7 Wall Street","Mon, 11 Sep 2023 22:43:47 -0400",NAN,Positive,Article,META
https://seekingalpha.com/article/4634480-rivian-im-willing-to-bet-on-this-dip-initiating-coverage-at-buy,https://cdn.snapi.dev/images/v1/b/i/image-1352304087-2058713.jpg,"Rivian: I'm Willing To Bet On This Dip; Initiating Coverage At Buy","Rivian is a smaller player in the EV market compared to Tesla, but at only 7% of current U.S. vehicle sales, the EV market is large enough for multiple players. The company is ramping up production of its more profitable R1S model, while still also delivering its enterprise delivery vehicles. Rivian's main challenge is scaling production and improving gross margins, but it has made progress and aims to achieve positive gross profits in 2024.","Seeking Alpha","Mon, 11 Sep 2023 22:38:32 -0400",paylimitwall,Positive,Article,RIVN
https://investorplace.com/2023/09/7-promising-battery-recycling-stocks-to-energize-your-portfolio/,https://cdn.snapi.dev/images/v1/p/k/battery-ev-vector-2058678.png,"7 Promising Battery Recycling Stocks to Energize Your Portfolio","Where will all of the electric vehicle (EV) batteries go when they die? Fortunately, most won't end up in landfills.",InvestorPlace,"Mon, 11 Sep 2023 21:00:44 -0400",NAN,Positive,Article,"AAPL,ABML,AMYZF,BYDDF,LICY,UMICY,GNENF,GNENY"
https://www.wsj.com/articles/apple-event-2023-iphone-15-wonderlust-five-things-f59f92ce,https://cdn.snapi.dev/images/v1/i/e/social-2058766.jpg,"Five Things to Look for at Apple's Tuesday iPhone Event","Among the expected new features are a different connector cord, a new button—and a higher price.",WSJ,"Mon, 11 Sep 2023 21:00:00 -0400","paywall",Negative,Article,AAPL
https://www.wsj.com/articles/google-antitrust-trial-doj-search-91d32f8f,https://cdn.snapi.dev/images/v1/j/z/social-2058788.jpg,"U.S. v. Google: What to Know About the Biggest Antitrust Trial in 20 Years","The search engine faces charges of using illegal agreements with phone and browser companies to maintain a monopoly.",WSJ,"Mon, 11 Sep 2023 21:00:00 -0400",paywall,Negative,Article,"GOOG,GOOGL"
https://www.youtube.com/watch?v=mzK-lfQuVX8,https://cdn.snapi.dev/images/v1/q/6/fmr-rep-barbara-comstock-talks-the-dojs-antitrust-suit-against-google-2058650.jpg,"Fmr. Rep Barbara Comstock talks the DOJ's antitrust suit against Google","Hosted by Brian Sullivan, “Last Call” is a fast-paced, entertaining business show that explores the intersection of money, culture and policy. Tune in Monday through Friday at 7 p.m.","CNBC Television","Mon, 11 Sep 2023 20:11:13 -0400",NAN,Negative,Video,"GOOG,GOOGL"
https://seekingalpha.com/article/4634405-intel-too-much-euphoria-on-a-foundry-prepayment,https://cdn.snapi.dev/images/v1/r/t/image-1469501056-2058640.jpg,"Intel: Too Much Euphoria On A Foundry Prepayment","Intel Corporation stock excitement is unwarranted, as the company has missed out on the AI GPU chip surge and will only benefit from fringe AI opportunities. Intel's Q3 results are expected to barely top guidance, with revenues down 12% YoY, while Nvidia's revenues are soaring. The foundry customer prepayment remains void of any actual details, including a definite agreement.","Seeking Alpha","Mon, 11 Sep 2023 20:00:00 -0400",paylimitwall,Negative,Article,INTC
https://www.zacks.com/commentary/2147412/tesla-2-other-upgrades-to-watch,https://cdn.snapi.dev/images/v1/x/2/urlhttps3a2f2fgfoolcdncom2feditorial2fimages2f7044312fstock-chart-on-tablet-young-womanjpgopresizew400h400-1584082-1608032-2058630.jpg,"Tesla & 2 Other Upgrades to Watch","Tesla's upgrade was centered around optimism for its custom supercomputer, Dojo, which is expected to generate considerable value for the EV titan as it continues its push into Full Self-Driving capabilities.","Zacks Investment Research","Mon, 11 Sep 2023 19:32:52 -0400",NAN,Positive,Article,"MCD,OC,TSLA"
https://www.zacks.com/stock/news/2147457/time-to-buy-apple-or-qualcomm-stock-for-their-renewed-partnership,https://cdn.snapi.dev/images/v1/l/1/41274-2058625.jpg,"Time to Buy Apple or Qualcomm Stock for Their Renewed Partnership","Considering their stock performances and growth since partnering in 2019, Apple (AAPL) and Qualcomm (QCOM) have complemented each other quite well.","Zacks Investment Research","Mon, 11 Sep 2023 19:32:12 -0400",NAN,Positive,Article,"AAPL,QCOM"
https://www.pymnts.com/acquisitions/2023/european-commission-delays-decision-on-amazons-acquisition-of-irobot/?utm_source=snapi,https://cdn.snapi.dev/images/v1/r/f/irobot-amazon-deal-457x274-2058610.png,"European Commission Delays Decision on Amazon's Acquisition of iRobot","European Union (EU) antitrust regulators have reportedly put a temporary halt to their investigation into Amazon's $1.7 billion acquisition of robot vacuum cleaner maker iRobot. The European Commission (EC), responsible for enforcing competition laws in the European Union, delayed its decision on the deal due to the absence of crucial information from the involved companies, Reuters reported",PYMNTS,"Mon, 11 Sep 2023 18:57:18 -0400",manda,Negative,Article,"AMZN,IRBT"
https://www.investors.com/news/sp-500-giants-amazon-netflix-wear-this-elite-leadership-badge/,https://cdn.snapi.dev/images/v1/r/z/med-20230828095735-the-5-most-upgraded-stocks-from-q2-earnings-report-2040768-2058616.jpg,"S&P 500 Giants Amazon, Netflix Headline 5 Real Market Leaders Near Buy Points","S&P 500 giants Amazon, Netflix and ServiceNow boast relative strength lines at new highs while still in bases, earning a coveted blue dot.","Investors Business Daily","Mon, 11 Sep 2023 18:28:01 -0400",NAN,Positive,Article,"AMZN,NFLX,CVNA,MANH,NOW"
https://www.youtube.com/watch?v=fm16D1UXzjY,https://cdn.snapi.dev/images/v1/f/d/apple-launch-event-google-vs-doj-what-to-watch-2058591.jpg,"Apple launch event, Google vs. DOJ: What to watch","Yahoo Finance Live co-host Seana Smith looks ahead and highlights the biggest headlines expected out tomorrow, Tuesday, September 12, including Apple's (AAPL) annual keynote event featuring the grand reveal of the iPhone 15 and Google's (GOOG, GOOGL) legal battle with the Department of Justice over an alleged monopoly on online search.","Yahoo Finance","Mon, 11 Sep 2023 18:15:01 -0400",product,Neutral,Video,"AAPL,GOOG,GOOGL"
https://www.marketwatch.com/story/microsofts-stock-has-a-rich-catalyst-path-ahead-after-underperforming-says-citi-97173fd1,https://cdn.snapi.dev/images/v1/b/f/im-820451size1777777777777778width800-2058586.jpg,"Microsoft's stock has a ‘rich catalyst path ahead' after underperforming, says Citi","Microsoft Corp. shares have lagged its technology peers in recent weeks, but Citi Research analysts think the stock is poised for better performance in the months to come.","Market Watch","Mon, 11 Sep 2023 18:15:00 -0400",paylimitwall,Positive,Article,MSFT
https://www.fastcompany.com/90951595/google-alphabet-antitrust-case-trial-explained,https://cdn.snapi.dev/images/v1/p/-/p-1-90951595-what-is-the-google-antitrust-case-all-about-search-engine-to-face-regulators-in-greatest-showdown-since-microsofts-2058655.jpg,"What is the Google antitrust case all about? Search engine to face regulators in greatest showdown since Microsoft's","The trial kicks off in Washington, D.C., on Tuesday.","Fast Company","Mon, 11 Sep 2023 18:00:00 -0400",paylimitwall,Neutral,Article,"GOOG,GOOGL"
https://seekingalpha.com/article/4634455-nvidia-corporation-nvda-bank-of-america-securities-global-i-conference-2023-transcript,https://cdn.snapi.dev/images/v1/u/q/transcript32-2058579.jpg,"NVIDIA Corporation (NVDA) Bank Of America Securities Global A.I. Conference 2023 (Transcript)","NVIDIA Corporation (NASDAQ:NVDA ) Bank Of America Securities Global A.I. Conference 2023 September 11, 2023 12:00 PM ET Company Participants Ian Buck - Vice President and General Manager of Hyperscale and HPC NVIDIA Conference Call Participants Vivek Arya - Bank of America Operator Ladies and gentlemen, the program is about to begin.","Seeking Alpha","Mon, 11 Sep 2023 17:53:09 -0400","paylimitwall",Neutral,Article,NVDA
https://www.proactiveinvestors.com/companies/news/1026141?SNAPI,https://cdn.snapi.dev/images/v1/s/a/2023-04-12-10-56-08-82a9b1d1a8411aed4899e8be42ecaf1f-2058548.jpg,"Get ready for the iPhone 15: what to expect from Apple's annual fall event Tuesday","Apple Inc (NASDAQ:AAPL)is expected to unveil the iPhone 15 at the company's annual fall event, which kicks off Tuesday at 10 am PT (1 pm ET)   The event, subtitled “Wonderlust” (not wanderlust) is Apple's first since the Vision Pro was revealed at the Worldwide Developers Conference in June.  For now, consumers are left wondering what the company will choose to reveal.","Proactive Investors","Mon, 11 Sep 2023 17:51:07 -0400",product,Neutral,Article,AAPL
https://seekingalpha.com/article/4634448-nvidia-better-to-enter-now-than-never,https://cdn.snapi.dev/images/v1/4/r/image-1494623400-2058573.jpg,"Nvidia: Better To Enter Now Than Never","According to the two DCF models I have created, Nvidia Corporation's fair stock price is approximately $451.90. This suggests that it is very close to its current price of $455.72. Nvidia could easily surpass the $1,000 share price mark between 2030 and 2032. Nvidia made an early entrance into the AI chips market, securing a significant number of loyal customers. This strategic move is expected to contribute to securing its revenue for the future.","Seeking Alpha","Mon, 11 Sep 2023 17:45:11 -0400",paylimitwall,Positive,Article,NVDA
https://www.marketwatch.com/story/amazons-stock-clinches-highest-close-in-more-than-a-year-d3d25d1c,https://cdn.snapi.dev/images/v1/c/f/im-850246size1777777777777778width800-2058543.jpg,"Amazon's stock clinches highest close in more than a year","Amazon.com Inc.'s stock secured its highest close in more than a year Monday as enthusiasm continues to build for the e-commerce giant's potential to improve the financial performance of its retail business.","Market Watch","Mon, 11 Sep 2023 17:41:00 -0400",paylimitwall,Positive,Article,AMZN
https://www.youtube.com/watch?v=-CK-yj-ZTwA,https://cdn.snapi.dev/images/v1/h/b/could-apple-stock-drop-after-iphone-launch-event-2058541.jpg,"Could Apple stock drop after iPhone launch event?","With Apple's (AAPL) iPhone 15 launch kicking off on Tuesday, the company's stock has historically proven to take a hit after its annual events. Yahoo Finance Markets Reporter Jared Blikre tracks Apple shares ahead of tomorrow, forecasting the positive boost the stock could receive in October.","Yahoo Finance","Mon, 11 Sep 2023 17:30:01 -0400",product,Negative,Video,AAPL
https://www.pymnts.com/credit-cards/2023/xbox-teams-with-mastercard-to-unveil-first-credit-card/?utm_source=snapi,https://cdn.snapi.dev/images/v1/x/b/xbox-credit-card-457x274-2058555.jpeg,"Xbox Teams With Mastercard to Unveil First Credit Card","Microsoft-owned gaming platform Xbox is debuting its first co-branded credit card in the U.S. The Barclays-issued Mastercard, announced Monday (Sept. 11), will be available on Sept. 21 exclusively to qualified Xbox Insiders across the country before becoming open to the general public in the U.S. starting next year.",PYMNTS,"Mon, 11 Sep 2023 17:17:03 -0400",NAN,Positive,Article,"MA,MSFT"
https://seekingalpha.com/article/4634352-amazon-vs-ftc-this-one-scenario-should-scare-investors,https://cdn.snapi.dev/images/v1/h/b/image-1540430389-2058484.jpg,"Amazon Vs. FTC: This One Scenario Should Scare Investors","The FTC is reportedly prepared to file a massive antitrust lawsuit against Amazon, potentially leading to the breakup of the conglomerate. However, there is just one scenario that should concern investors. How concerned should Amazon investors be, and is the stock still a buy?","Seeking Alpha","Mon, 11 Sep 2023 17:00:00 -0400",paylimitwall,Negative,Article,AMZN
https://www.pymnts.com/apple/2023/apples-new-launches-may-drive-shift-to-services-ecosystem/?utm_source=snapi,https://cdn.snapi.dev/images/v1/a/p/apple-2058549.jpg,"Apple's New Launches May Drive Shift to Services Ecosystem","For Apple, Tuesday (Sept. 12) will mark the latest launch of its latest slate of hardware updates.",PYMNTS,"Mon, 11 Sep 2023 16:59:05 -0400",NAN,Neutral,Article,AAPL
https://www.youtube.com/watch?v=IaV3KiEDDlU,https://cdn.snapi.dev/images/v1/d/a/apple-renews-qualcomm-deal-in-sign-its-own-chip-isnt-ready-2058464.jpg,"Apple Renews Qualcomm Deal in Sign Its Own Chip Isn't Ready","Apple is extending an agreement to get modem semiconductors from Qualcomm for three more years, a sign that its ambitious effort to design the chips in-house is taking longer than expected. Bloomberg's Mark Gurman joins Ed Ludlow on Bloomberg Technology.","Bloomberg Technology","Mon, 11 Sep 2023 16:43:16 -0400",NAN,Neutral,Video,"AAPL,QCOM"
https://www.investors.com/news/sp-500-tesla-apple-chipmaker-lead-big-movers/,https://cdn.snapi.dev/images/v1/d/d/urlhttps3a2f2fgfoolcdncom2feditorial2fimages2f7433362ffintech-payment-app-hands-smartphonejpgopresizew400h400-2048167-2058478.jpg,"S&P 500: Tesla, Apple Chipmaker Lead Big Movers","Tesla led the S&P 500 Monday, surging on an upgrade. Apple chipmaker Qualcomm rose solidly.","Investors Business Daily","Mon, 11 Sep 2023 16:35:00 -0400",NAN,Positive,Article,"AAPL,TSLA"
https://www.youtube.com/watch?v=3AU1YKmIZ04,https://cdn.snapi.dev/images/v1/g/4/apple-event-2023-heres-what-to-expect-2058375.jpg,"Apple Event 2023: Here's what to expect","Tim Long, Barclays senior research analyst, joins 'Closing Bell' to discuss Apple's launch event tomorrow.","CNBC Television","Mon, 11 Sep 2023 16:09:13 -0400",product,Neutral,Video,AAPL
https://www.gurufocus.com/news/2082897/teslas-dojo-supercomputer-may-boost-companys-value-by-500-billion,https://cdn.snapi.dev/images/v1/r/s/106269004-1574891231068gettyimages-1044540656-2058329.jpeg,"Tesla's Dojo Supercomputer May Boost Company's Value by $500 Billion","The valuation of Tesla Inc (TSLA, Financial), the world-renowned electric vehicle manufacturer, may be set for a significant boost thanks to its Dojo supercomputer, according to a recent analysis by Morgan Stanley (MS, Financial). Analysts led by Adam Jonas have expressed optimism that the artificial intelligence technological network developed by Tesla Inc ( TSLA , Financial) could add up to $500 billion to the company's enterprise value.",GuruFocus,"Mon, 11 Sep 2023 16:06:32 -0400",NAN,Positive,Article,TSLA
