news_url,image_url,title,text,source_name,date,topics,sentiment,type,tickers
https://www.fool.com/investing/2023/12/19/nvidia-is-investing-in-biotech-heres-what-it-means/,https://cdn.snapi.dev/images/v1/b/p/v72-2202047.jpg,"Nvidia Is Investing in Biotech Like Wild. Here's What It Means for the Stock.","Nvidia is forging collaborations and making investments in biotech. It's positioning to facilitate using artificial intelligence for drug discovery.","The Motley Fool","Tue, 19 Dec 2023 09:53:00 -0500",NAN,Positive,Article,NVDA
https://www.zacks.com/stock/news/2199840/5-nasdaq-composite-laggards-likely-to-gather-pace-in-2024,https://cdn.snapi.dev/images/v1/x/9/35286-2202035.jpg,"5 Nasdaq Composite Laggards Likely to Gather Pace in 2024","We have narrowed our search to five Nasdaq Composite listed laggards of 2023 with strong potential for 2024. These are: PEP, KHC, WMG, PODD, BGNE.","Zacks Investment Research","Tue, 19 Dec 2023 09:47:33 -0500",NAN,Neutral,Article,"BGNE,KHC,PEP,PODD,WMG"
https://www.zacks.com/stock/news/2199843/bitcoin-to-shine-in-2024-are-these-5-stocks-on-your-radar,https://cdn.snapi.dev/images/v1/l/2/4284-2202033.jpg,"Bitcoin to Shine in 2024: Are These 5 Stocks on Your Radar?","Stocks like NVIDIA Corporation (NVDA), Coinbase Global (COIN), Block (SQ), Interactive Brokers Group (IBKR) and PayPal Holdings (PYPL) are likely to benefit in the near term form the Bitcoin rally.","Zacks Investment Research","Tue, 19 Dec 2023 09:47:30 -0500",NAN,Positive,Article,"COIN,IBKR,NVDA,PYPL,SQ"
https://www.zacks.com/stock/news/2199863/these-4-retail-stocks-have-outshone-the-s-p-500-in-2023,https://cdn.snapi.dev/images/v1/h/r/344-2202025.jpg,"These 4 Retail Stocks Have Outshone the S&P 500 in 2023","The impressive performance of players such as AMZN, ANF, GPS and DECK highlights the ability to adapt and thrive in the dynamic market conditions.","Zacks Investment Research","Tue, 19 Dec 2023 09:47:19 -0500",NAN,Positive,Article,"AMZN,ANF,DECK,GPS"
https://www.zacks.com/stock/news/2199870/nvidia-nvda-up-243-ytd-will-it-carry-momentum-in-2024,https://cdn.snapi.dev/images/v1/2/p/534-2202023.jpg,"NVIDIA (NVDA) Up 243% YTD: Will It Carry Momentum in 2024?","NVIDIA (NVDA) stock is likely to carry the upward momentum in 2024 on hopes that the company will be a prime beneficiary of growing investments in generative AI.","Zacks Investment Research","Tue, 19 Dec 2023 09:47:15 -0500",NAN,Positive,Article,NVDA
https://www.zacks.com/stock/news/2199886/4-etf-areas-stocks-to-win-on-upbeat-november-retail-sales,https://cdn.snapi.dev/images/v1/v/g/1940-2202018.jpg,"4 ETF Areas & Stocks to Win on Upbeat November Retail Sales","Retail Sales in the United States increased 4.1% year-on-year in November 2023, marking the strongest annual growth since February, following a downwardly revised 2.2% gain in October.","Zacks Investment Research","Tue, 19 Dec 2023 09:47:07 -0500",NAN,Positive,Article,"AMZN,BFIT,CARZ,EATZ,GPI,ONLN,PG,WING"
https://www.zacks.com/stock/news/2199870/nvidia-nvda-up-243-ytd-will-it-carry-momentum-in-2024,https://cdn.snapi.dev/images/v1/2/p/534-2202023.jpg,"NVIDIA (NVDA) Up 243% YTD: Will It Carry Momentum in 2024?","NVIDIA (NVDA) stock is likely to carry the upward momentum in 2024 on hopes that the company will be a prime beneficiary of growing investments in generative AI.","Zacks Investment Research","Tue, 19 Dec 2023 09:47:15 -0500",NAN,Positive,Article,NVDA
https://www.zacks.com/stock/news/2199886/4-etf-areas-stocks-to-win-on-upbeat-november-retail-sales,https://cdn.snapi.dev/images/v1/v/g/1940-2202018.jpg,"4 ETF Areas & Stocks to Win on Upbeat November Retail Sales","Retail Sales in the United States increased 4.1% year-on-year in November 2023, marking the strongest annual growth since February, following a downwardly revised 2.2% gain in October.","Zacks Investment Research","Tue, 19 Dec 2023 09:47:07 -0500",NAN,Positive,Article,"AMZN,BFIT,CARZ,EATZ,GPI,ONLN,PG,WING"
https://www.pymnts.com/artificial-intelligence-2/2023/tomtom-develops-in-car-voice-ai-assistant-with-microsoft/?utm_source=snapi,https://cdn.snapi.dev/images/v1/t/o/tomtom-aijpgw457-2202009.jpg,"TomTom Develops In-Car Voice AI Assistant With Microsoft","Mapping/navigation company TomTom says it has developed an artificial intelligence (AI)-powered, in-car conversational assistant in collaboration with Microsoft. The tool offers enhanced voice interaction with infotainment, location search, and vehicle command systems, and arrives at the end of a year that saw voice AI integrated into more and more applications.",PYMNTS,"Tue, 19 Dec 2023 09:38:19 -0500",NAN,Positive,Article,"MSFT,TMOAF"
https://www.fool.com/investing/2023/12/19/2-electric-vehicle-stocks-you-can-buy-right-now-be/,https://cdn.snapi.dev/images/v1/u/r/urlhttps3a2f2fgfoolcdncom2feditorial2fimages2f7583162fgettyimages-1425941216jpgopresizew400h400-2202007.jpg,"2 Electric Vehicle Stocks You Can Buy Right Now Before They Surge Even Higher","Trends in global electric vehicle demand present a lucrative long-term opportunity. Tesla is also actively pursuing autonomous driving, artificial intelligence, and robotics.","The Motley Fool","Tue, 19 Dec 2023 09:37:00 -0500",NAN,Positive,Article,"BYDDY,TSLA,BYDDF"
https://seekingalpha.com/article/4658656-nvidia-is-an-alpha-you-chase-at-dips-rating-upgrade,https://cdn.snapi.dev/images/v1/q/l/nvdamsn-300x165-2201983.jpg,"Nvidia Is An Alpha You Chase At Dips (Rating Upgrade)","Nvidia Corporation has smashed expectations again, thanks to its promising forward guidance, highly profitable margins, and raised consensus estimates through FY2026. Assuming that it continues to command the lion's share in the discrete GPU and AI chips, we believe that Nvidia stock's premium growth valuations and subsequent rallies are well deserved. With the latest clarification from the chief of the US Department of Commerce, we believe that Nvidia's superior offerings will remain popular in China, once the export limitations are finalized.","Seeking Alpha","Tue, 19 Dec 2023 09:30:06 -0500",paylimitwall,Positive,Article,NVDA
https://www.businesswire.com/news/home/20231219420079/en/Emplifi-Reports-Instagram-Reels-Outperformed-All-Other-Video-Content-Across-Instagram-Facebook-and-TikTok/,https://cdn.snapi.dev/images/v1/j/u/press13-2201986.jpg,"Emplifi Reports Instagram Reels Outperformed All Other Video Content Across Instagram, Facebook, and TikTok","NEW YORK--(BUSINESS WIRE)--Emplifi, a leading customer engagement platform, today released video performance data for branded Instagram Reels, Facebook Reels and videos, and TikTok content, offering advertisers valuable insights as they develop social media marketing strategies for the year ahead. After analyzing 2023 video performance for thousands of brand-owned social media accounts using the Emplifi Social Marketing Cloud, Emplifi discovered Instagram Reels are generating massive results fo.","Business Wire","Tue, 19 Dec 2023 09:30:00 -0500",PressRelease,Neutral,Article,META
https://www.youtube.com/watch?v=oixdcIjXoDA,https://cdn.snapi.dev/images/v1/7/g/amazon-in-talks-to-partner-with-diamond-sports-wsj-2201936.jpg,"Amazon in talks to partner with Diamond Sports: WSJ","According to a report from the Wall Street Journal, Amazon (AMZN) is now in talks for a potential deal with regional sports network Diamond Sports. The network filed for Chapter 11 bankruptcy protection back in March of this year.","Yahoo Finance","Tue, 19 Dec 2023 09:02:31 -0500",NAN,Positive,Video,AMZN
https://www.prnewswire.com/news-releases/frito-lays-us-snack-index-predicts-2024-trends-amidst-an-increasing-time-crunch-302019073.html,https://cdn.snapi.dev/images/v1/s/b/press2-2201917.jpg,"Frito-Lay's U.S. Snack Index Predicts 2024 Trends Amidst an Increasing Time Crunch","One-third of Americans have just 30 minutes to prepare and enjoy meals—less time than their average work commutes and TV shows #GirlDinner is for everyone in 2024 PLANO, Texas , Dec. 19, 2023 /PRNewswire/ -- The fifth annual U.S. Snack Index confirms what many of us are feeling – there are simply not enough hours in the day. A lack of time to prepare, eat and enjoy meals – especially among parents and younger generations – will blur the once-clear line between snacks and meals in 2024.",PRNewsWire,"Tue, 19 Dec 2023 09:01:00 -0500",PressRelease,Neutral,Article,PEP
https://www.businesswire.com/news/home/20231218840045/en/Contents-First-to-Release-Tappytoon%E2%80%99s-Popular-Romance-Web-Novels-on-Amazon-Kindle/,https://cdn.snapi.dev/images/v1/s/5/press4-2201996.jpg,"Contents First to Release Tappytoon's Popular Romance Web Novels on Amazon Kindle","LOS ANGELES & SEOUL, South Korea--(BUSINESS WIRE)--Contents First, a global leader in digital comics specializing in IP development, production, distribution, and transmedia, announced today that it will begin publishing English e-book versions of romance fantasy web novels popularized by its Tappytoon reading platform. The Broken Ring: This Marriage Will Fail Anyway, a web novel by ChaCha Kim, and I Tamed My Ex-Husband's Mad Dog, a web novel by Jkyum, will be released on Amazon Kindle in the U.","Business Wire","Tue, 19 Dec 2023 09:00:00 -0500",PressRelease,Neutral,Article,AMZN
https://nypost.com/2023/12/19/business/elon-musk-says-tesla-cybertruck-may-soon-double-as-a-boat/,https://cdn.snapi.dev/images/v1/v/i/view-tesla-cybertruck-wheel-seen-73937886jpgquality90stripall-2201913.jpg,"Elon Musk says Tesla Cybertruck may soon be able to function as a boat","Tesla's Cybertruck may soon be able to function dually as an electric pickup and boat, Elon Musk revealed on X on Monday.","New York Post","Tue, 19 Dec 2023 08:57:17 -0500",CEO,Positive,Article,TSLA
https://www.wsj.com/articles/apple-needs-to-sell-its-vision-b547d60e,https://cdn.snapi.dev/images/v1/z/r/laurenz-heymann-vkfhjlz5smq-unsplash-2-2139469-2201855.jpg,"Apple Needs to Sell its Vision","The halting of Apple Watch sales adds another growth challenge as the tech company also misses out on the artificial-intelligence rally.","WSJ,"Tue, 19 Dec 2023 08:51:00 -0500",paywall,Negative,Article,AAPL
https://www.businessinsider.com/apple-watch-vision-pro-problems-at-3-trillion-peak-2023-12,https://cdn.snapi.dev/images/v1/6/5/65818dcc1c5c7b8c9a0995f1formatjpeg-2201841.jpg,"Apple is worth $3 trillion. It also has a few obvious problems.","Apple is heading into 2024 as the world's most valuable company again. The company's share price is high, but hardware sales and China are areas of weakness.","Business Insider","Tue, 19 Dec 2023 08:44:33 -0500",paylimitwall,Neutral,Article,AAPL
https://247wallst.com/investing/2023/12/19/5-reasons-to-avoid-amazon-stock-amzn-at-all-costs/,https://cdn.snapi.dev/images/v1/c/d/catalog-mail3-2201991.jpg,"5 Reasons To Avoid Amazon Stock (AMZN) At All Costs","Sponsored: Tips for Investing A financial advisor can help you understand the advantages and disadvantages of investment properties.","24/7 Wall Street","Tue, 19 Dec 2023 08:42:03 -0500",NAN,Negative,Article,AMZN
https://www.investors.com/news/tesla-stock-early-buy-point-on-strong-china-registrations/,https://cdn.snapi.dev/images/v1/i/g/sqlkwd2ed-2201857.jpg,"Tesla Stock At Early Buy Point On Strong China Registrations As EV Giant Strains For Delivery Target","Tesla China registrations last week surged nearly 19%, the EV giant's third highest weekly total.","Investors Business Daily","Tue, 19 Dec 2023 08:32:34 -0500",NAN,Positive,Article,TSLA
https://finbold.com/tesla-stock-price-prediction-for-2024-bullish-and-bearish-forecasts/?utm_source=snapi,https://cdn.snapi.dev/images/v1/f/e/tesla-stock-price-prediction-for-2024-bullish-and-bearish-forecasts-2201780.jpg,"Tesla stock price prediction for 2024: Bullish and Bearish forecasts","Overall, Elon Musk's electric vehicle (EV) company, Tesla (NASDAQ: TSLA), has had a very strong 2023. The EV maker's successes are particularly highlighted by early investor worries over Musk's divided attention after his X (at the time known as Twitter) acquisition and the broader slowdown in the EV market.",Finbold,"Tue, 19 Dec 2023 08:32:05 -0500",NAN,Neutral,Article,TSLA
https://www.cnbc.com/2023/12/19/vr-market-shrinking-as-meta-pours-billions-of-dollars-into-metaverse.html,https://cdn.snapi.dev/images/v1/6/z/107201031-1677606399602-gettyimages-1247559120-spain-mwc-2023-2201804.jpeg,"VR market keeps shrinking even as Meta pours billions of dollars a quarter into metaverse","Sales of VR headsets and AR glasses in the U.S. have plummeted nearly 40% this year, while Meta has invested billions of dollars into the technology",CNBC,"Tue, 19 Dec 2023 08:30:01 -0500",NAN,Negative,Article,META
https://www.youtube.com/watch?v=IR1kEb8PMFc,https://cdn.snapi.dev/images/v1/1/t/tesla-to-raise-pay-for-hourly-nevada-gigafactory-workers-in-january-2201740.jpg,"Tesla to raise pay for hourly Nevada Gigafactory workers in January","CNBC's Becky Quick reports on the latest news.","CNBC Television","Tue, 19 Dec 2023 08:09:06 -0500",NAN,Positive,Video,TSLA
https://www.fool.com/investing/2023/12/19/3-artificial-intelligence-ai-stocks-for-2024-and-b/,https://cdn.snapi.dev/images/v1/a/k/urlhttps3a2f2fgfoolcdncom2feditorial2fimages2f7581952fgoog-google-stock-supercomputer-ai-artificial-intelligencejpgopresizew400h400-2201713.jpg,"3 Artificial Intelligence (AI) Stocks for 2024 (and Beyond)","Demand for Palantir's products is skyrocketing. SoundHound's role in AI is vastly underrated.","The Motley Fool","Tue, 19 Dec 2023 08:05:00 -0500",NAN,Positive,Article,"GOOG,PLTR,SOUN"
https://seekingalpha.com/article/4658644-naval-task-force-japanese-takeover,https://cdn.snapi.dev/images/v1/s/y/podc4-2201678.jpg,"Naval Task Force; Japanese Takeover","Naval taskforce formed to protect commercial vessels in the Red Sea from Houthi rebel attacks.","Seeking Alpha","Tue, 19 Dec 2023 08:00:00 -0500","manda,podcast,paylimitwall",Neutral,Article,"GOOG,GOOGL,KVUE,NPSCY,X"
https://www.fool.com/investing/2023/12/19/can-costco-stock-reach-1000-in-2024/,https://cdn.snapi.dev/images/v1/u/r/urlhttps3a2f2fgfoolcdncom2feditorial2fimages2f7584732fwarehouse-shopper-costco-shoppingjpgopresizew400h400-2201831.jpg,"Can Costco Stock Reach $1","000 in 2024?,Costco beat Wall Street expectations in the most recent fiscal quarter. Investors are happy with the announcement of a one-time $15 dividend.","The Motley Fool","Tue, 19 Dec 2023 08:00:00 -0500",NAN,Positive,Article,COST
https://www.barrons.com/articles/apple-stock-buy-sell-watch-a7e437fb,https://cdn.snapi.dev/images/v1/z/1/ukfgwhr2cjikthxy6loigseivq-2198968-2200525-2201674.jpg,"Apple Stock Is Being Hit by Watch"," China Concerns. Ignore the Noise.,Apple stock is struggling to break through the $200 barrier as it contends with potential bad news around sales of both its Watch and iPhones.",Barrons,"Tue, 19 Dec 2023 07:57:00 -0500",paywall,Negative,Article,AAPL
https://www.prnewswire.com/news-releases/elevat-announces-groundbreaking-technical-partnership-with-microsoft-to-revolutionize-iot-with-the-heavy-machinery-industries-302018080.html,https://cdn.snapi.dev/images/v1/l/2/press13-2201669.jpg,"Elevat Announces Groundbreaking Technical Partnership with Microsoft to Revolutionize IoT with the Heavy Machinery industries","Machine Connect and Azure IoT Edge SEATTLE, Dec. 19, 2023 /PRNewswire/ -- Elevat Inc (Elevat) is thrilled to announce a strategic technical partnership with Microsoft Corp. (NASDAQ: MSFT) that will reshape the Internet of Things (IoT) landscape. Leveraging Elevat Machine Connect and Microsoft Azure Edge, this collaboration promises to accelerate digital transformation and empower businesses with unprecedented connectivity and insights.",PRNewsWire,"Tue, 19 Dec 2023 07:45:00 -0500",PressRelease,Neutral,Article,MSFT
https://www.fool.com/investing/2023/12/19/who-will-win-this-15-trillion-market-opportunity-i/,https://cdn.snapi.dev/images/v1/u/r/urlhttps3a2f2fgfoolcdncom2feditorial2fimages2f7578802ftwo-software-engineers-walking-down-an-aisle-of-a-data-centerjpgopresizew400h400-2201823.jpg,"Who Will Win This $1.5 Trillion Market Opportunity in 2024?","Amazon Web Services holds the lead, with the highest market share. Google Cloud and Microsoft Azure had a much better 2023 than AWS.","The Motley Fool","Tue, 19 Dec 2023 07:45:00 -0500",NAN,Positive,Article,"AMZN,GOOG,GOOGL,MSFT"
https://www.marketwatch.com/story/pepsico-downgraded-to-neutral-at-j-p-morgan-on-limited-room-for-positive-surprises-10cf4da5,https://cdn.snapi.dev/images/v1/f/x/urlhttps3a2f2fgfoolcdncom2feditorial2fimages2f5396742fgettyimages-997122992jpgw700opresize-2201658.jpg,"PepsiCo downgraded to neutral at J.P.Morgan on ‘limited room for positive surprises'","PepsiCo Inc.'s stock PEP, +1.14% was down by 0.7% in premarket trading on Tuesday after J.P.Morgan analyst Andrea Teixeira downgraded the soft drink and snack giant to neutral from buy and cut its price target to $176 a share from $185 a share. “We don't see anything fundamentally wrong with PEP and continue to have confidence that the company is well positioned to deliver on its 2024 outlook, said Teixeira.","Market Watch","Tue, 19 Dec 2023 07:40:00 -0500",paylimitwall,Negative,Article,PEP
https://www.fool.com/investing/2023/12/19/feel-like-you-missed-the-nvidia-train-think-again/,https://cdn.snapi.dev/images/v1/s/7/a100-front-edit-19x10-1jpgw711-2201591.jpg,"Feel Like You Missed the Nvidia Train? Think Again.","Nvidia's graphics processing units (GPUs) are in high demand for AI applications. The company's revenue has soared over the last year, but margin expansion and rising profits shouldn't go unnoticed.","The Motley Fool","Tue, 19 Dec 2023 07:17:00 -0500",NAN,Positive,Article,NVDA
https://finbold.com/meta-stock-hits-52-week-high-on-track-for-best-ever-year/?utm_source=snapi,https://cdn.snapi.dev/images/v1/v/p/meta-stock-hits-52-week-high-on-track-for-best-ever-year-2201568.jpg,"Meta stock hits 52-week high"," on track for best-ever year, Following a formidable 2022 drought that tested its resilience, Meta Platforms (NASDAQ: META) has orchestrated a remarkable rebound this year.",Finbold,"Tue, 19 Dec 2023 07:12:50 -0500",NAN,Positive,Article,META
https://www.marketbeat.com/originals/apple-may-be-a-4t-company-by-next-year-but-is-it-a-buy-now/?utm_source=snapi,https://cdn.snapi.dev/images/v1/g/l/med-20231218153134-apple-may-be-a-4t-company-by-next-year-but-is-it-a-2201513.jpg,"Apple may be a 4T company by next year, but is it a buy now?", "Apple Inc. NASDAQ: AAPL is one of the most hotly debated stocks for investors to consider. Nearly everybody believes that Apple is one of the most well-run companies among technology stocks.",MarketBeat,"Tue, 19 Dec 2023 07:01:44 -0500",NAN,Neutral,Article,AAPL
https://www.marketbeat.com/originals/bevs-are-out-hybrids-are-in-heres-where-to-invest/?utm_source=snapi,https://cdn.snapi.dev/images/v1/0/8/med-20231218113532-bevs-are-out-hybrids-are-in-heres-where-to-invest-2201500.jpg,"BEVs are out, hybrids are in; here's where to invest","The BEV battery electric vehicle market isn't extinct or even dying. Still, several developments suggest that it has matured quicker than expected, demand is less than forecast, and the hybrid vehicle market is getting a lift.",MarketBeat,"Tue, 19 Dec 2023 07:00:29 -0500",NAN,Neutral,Article,"AMZN,LCID,NKLA,PLUG,RIVN,TM,WMT"
https://investorplace.com/2023/12/7-growth-stocks-to-avoid-no-matter-what/,https://cdn.snapi.dev/images/v1/j/n/growthstocks-1600-02-2201502.jpg,"7 Growth Stocks to Avoid No Matter What","Growth stocks certainly have legs at the moment and it's fair to assume that there will be a surge of investment heading into 2024. Demand should be expected to rise as the Federal Reserve continues to signal that the worst is over.",InvestorPlace,"Tue, 19 Dec 2023 07:00:00 -0500",NAN,Neutral,Article,"AI,COIN,DASH,LCID,PAYC,RIVN,UPST"
https://www.fool.com/investing/2023/12/19/2-reasons-to-buy-amazon-stock-like-theres-no-tomor/,https://cdn.snapi.dev/images/v1/q/1/amazon-logo-2565-2201503.jpg,"2 Reasons to Buy Amazon Stock Like There's No Tomorrow","Amazon's stock has gained nearly 80% year to date. The company has rallied investors with an impressive turnaround in its e-commerce business.","The Motley Fool","Tue, 19 Dec 2023 07:00:00 -0500",NAN,Positive,Article,AMZN
https://www.businessinsider.com/tesla-raises-worker-wages-nevada-gigafactory-amid-union-pressure-2023-12,https://cdn.snapi.dev/images/v1/6/5/65816f791c5c7b8c9a099068formatjpeg-2201585.jpg,"Tesla is giving some Gigafactory workers a raise. It coincides with a union drive.","Tesla is planning to raise the pay of hourly workers at its factory in Nevada. Some workers will see a raise of about 10%, CNBC reported.","Business Insider","Tue, 19 Dec 2023 06:59:55 -0500",paylimitwall,Positive,Article,TSLA
https://finbold.com/wall-street-sets-costco-stock-price-for-the-next-12-months-2/?utm_source=snapi,https://cdn.snapi.dev/images/v1/d/d/wall-street-sets-costco-stock-price-for-the-next-12-months-2201501.jpg,"Wall Street sets Costco stock price for the next 12 months","Costco Wholesale Corp (NASDAQ: COST) shares reached a record high, surging over 4% in intraday trading on December 15. The boost followed the release of fiscal first-quarter results that exceeded analysts' expectations, with consumers drawn to Costco for its competitive prices on groceries and other products.",Finbold,"Tue, 19 Dec 2023 06:59:18 -0500",NAN,Positive,Article,COST
https://www.marketwatch.com/story/hedge-fund-manager-takes-up-the-ten-surprise-mantle-his-call-apple-stock-will-slump-s-p-will-sputter-and-oil-will-surge-8517e560,https://cdn.snapi.dev/images/v1/l/w/im-34169217size1777777777777778width800-2201497.jpg,"Hedge fund manager takes up the ‘ten surprise' mantle. His call: Apple stock will slump"," S&P will sputter and oil will surge,Byron Wien, a respected market strategist at Morgan Stanley and then Blackstone, died this year at the age of 90. His “10 surprises” column was awaited annually, not so much for their prescience but for being provocative, stirring outside the box thinking.","Market Watch","Tue, 19 Dec 2023 06:55:00 -0500","paylimitwall",Neutral,Article,AAPL
https://www.pymnts.com/antitrust/2023/google-agrees-to-700-million-settlement-in-play-store-case/?utm_source=snapi,https://cdn.snapi.dev/images/v1/g/o/google-china-google-play-app-store-relaunchjpgw457-2201584.jpg,"Google Agrees to $700 Million Settlement in Play Store Case","Google will pay $700 million to settle an antitrust suit involving its Play store. The tech giant announced the settlement Monday (Dec. 18), revealing the details of a September agreement in a 2020 suit by the U.S. government and several states.",PYMNTS,"Tue, 19 Dec 2023 06:46:31 -0500",NAN,Positive,Article,"GOOG,GOOGL"
https://www.fool.com/investing/2023/12/19/better-artificial-intelligence-ai-stock-alphabet-v/,https://cdn.snapi.dev/images/v1/m/v/urlhttps3a2f2fgfoolcdncom2feditorial2fimages2f7586022fai-artificial-intelligence-robots-working-officejpgopresizew400h400-2201494.jpg,"Better Artificial Intelligence (AI) Stock: Alphabet vs. Amazon","The AI market is expected to grow at a CAGR of more than 35% for the rest of the decade. Meanwhile, Alphabet will launch a new large language model in 2024 that could unlock countless growth opportunities in AI.","The Motley Fool","Tue, 19 Dec 2023 06:45:00 -0500",NAN,Neutral,Article,"AMZN,GOOG,GOOGL"
https://techxplore.com/news/2023-12-apple-billion-business.html,https://cdn.snapi.dev/images/v1/4/z/apple-inc-2201485.jpg,"Apple plans rescue for $17 billion watch business in face of ban","Apple Inc., just days away from a U.S. ban of its smartwatches, is plotting a rescue mission for the $17 billion business that includes software fixes and other potential workarounds.",TechXplore,"Tue, 19 Dec 2023 06:39:57 -0500",NAN,Positive,Article,AAPL
https://www.youtube.com/watch?v=NP2xfEvR9cA,https://cdn.snapi.dev/images/v1/w/f/microsoft-a-top-tech-innovator-says-imd-2201471.jpg,"Microsoft a top tech innovator, says IMD","Howard Yu, professor of management and innovation at IMD, discusses the organization's Future Readiness Indicator 2023, which highlights companies demonstrating major innovation in the tech, pharma and fashion sectors.","CNBC International TV","Tue, 19 Dec 2023 06:22:15 -0500",NAN,Positive,Video,MSFT
https://www.fool.com/investing/2023/12/19/is-microsoft-stock-a-buy-now/,https://cdn.snapi.dev/images/v1/1/y/urlhttps3a2f2fgfoolcdncom2feditorial2fimages2f5310162fmicrosoft-campusjpgw700opresize-2201462.jpg,"Is Microsoft Stock a Buy Now?","Microsoft benefits from cloud computing and artificial intelligence, kicking off its fiscal 2024 with strong revenue growth. The tech giant's impressive cloud computing and AI technologies are helping it capture customers and market share.","The Motley Fool","Tue, 19 Dec 2023 06:15:00 -0500",NAN,Positive,Article,MSFT
https://www.marketbeat.com/originals/top-semiconductor-stocks-for-2024-that-arent-nvidia/?utm_source=snapi,https://cdn.snapi.dev/images/v1/1/i/med-20231218183332-top-semiconductor-stocks-for-2024-that-arent-nvidi-2201455.jpg,"Top semiconductor stocks for 2024 that aren't NVIDIA","NVIDIA NASDAQ: NVDA will continue to lead the AI semiconductor market in 2024, but signs are growing other companies are also well positioned, and there is market share to be gained. The opportunity is twofold.",MarketBeat,"Tue, 19 Dec 2023 06:10:17 -0500",NAN,Positive,Article,NVDA
