news_url,image_url,title,text,source_name,date,topics,sentiment,type,tickers
https://www.zacks.com/stock/news/2199375/brokers-suggest-investing-in-meta-platforms-meta-read-this-before-placing-a-bet,https://cdn.snapi.dev/images/v1/w/f/default23-2200325.jpg,"Brokers Suggest Investing in Meta Platforms (META): Read This Before Placing a Bet","Investors often turn to recommendations made by Wall Street analysts before making a Buy, Sell, or Hold decision about a stock. While media reports about rating changes by these brokerage-firm employed (or sell-side) analysts often affect a stock's price, do they really matter?","Zacks Investment Research","Mon, 18 Dec 2023 10:31:10 -0500",NAN,Neutral,Article,META
https://www.youtube.com/watch?v=kWT_sxrizLI,https://cdn.snapi.dev/images/v1/d/w/costco-ceo-selling-all-sorts-of-crazy-things-seems-to-work-for-us-2200363.jpg,"Costco CEO: Selling all sorts of crazy things seems to work for us","Craig Jelinek, outgoing Costco CEO, joins 'Squawk on the Street' to discuss the company's ability to retain its talent, how it can keep low prices without losing margins, and more.","CNBC Television","Mon, 18 Dec 2023 10:24:50 -0500",CEO,Neutral,Video,COST
https://investorplace.com/2023/12/7-inflation-proof-consumer-staples-stocks-to-buy-in-december/,https://cdn.snapi.dev/images/v1/j/t/inflation-1600-2200321.jpg,"7 Inflation-Proof Consumer Staples Stocks to Buy in December","In an economy tackling persistent inflation, where core prices edged up in November, and the year-on-year core rate remained at 4%, investors are looking toward the future. On a more positive note, with anticipated rate cuts on the horizon post-Fed's recent meeting, the focus shifts to inflation-resistant investments.",InvestorPlace,"Mon, 18 Dec 2023 10:21:58 -0500",StocksToWatch,Positive,Article,"BUD,CL,MDLZ,PCG,PEP,PG,PM"
https://www.proactiveinvestors.co.uk/companies/news/1036511?SNAPI,https://cdn.snapi.dev/images/v1/6/m/wh40k-guillimanvsblacklegion2018-2200307.jpg,"Games Workshop's Warhammer tie-in with Amazon ‘a huge opportunity' - analyst","Equities analysts at Jefferies see long-term potential in Games Workshop Group PLC (LSE:GAW)'s confirmed tie-in with Amazon.com Inc (NASDAQ:AMZN, ETR:AMZ), which will see the streaming giant translate the London-listed group's popular Warhammer 40k franchise into film and TV content. ""The potential for Warhammer to build its global exposure is clearly a huge opportunity, said analysts.","Proactive Investors","Mon, 18 Dec 2023 10:19:03 -0500",NAN,Positive,Article,"GMWKF,AMZN"
https://finbold.com/ai-predicts-amazon-price-on-xmas-day/?utm_source=snapi,https://cdn.snapi.dev/images/v1/q/v/ai-predicts-amazon-price-on-xmas-day-2200283.jpg,"AI predicts Amazon price on Xmas day","The e-commerce giant Amazon (NASDAQ: AMZN) has been offering impressive stock market performance throughout 2023. This year, the growth was largely driven by the strength of its AWS business, as well as by some strategic moves into the artificial intelligence (AI) sector that rose to take center stage late last year with the launch of OpenAI's flagship platform – ChatGPT.",Finbold,"Mon, 18 Dec 2023 10:07:09 -0500",NAN,Positive,Article,AMZN
https://seekingalpha.com/article/4658439-tesla-recalls-cant-stop-stock-rally,https://cdn.snapi.dev/images/v1/f/f/image-1434797508-2200313.jpg,"Tesla's Recalls Can't Stop The Rally","Tesla's recalls, impacting over 2 million vehicles, stem from potential Autopilot misuse and safety issues, triggering regulatory scrutiny but not fundamentally eroding the company's development path. Despite initial stock dips, TSLA rebounded, indicating investor confidence in the company's proactive recall measures and product safety. Potential lawsuits loom over Tesla, highlighting concerns about legal liabilities and financial implications resulting from alleged Autopilot defects contributing to accidents.","Seeking Alpha","Mon, 18 Dec 2023 10:00:07 -0500",paylimitwall,Positive,Article,TSLA
https://seekingalpha.com/article/4658039-meta-whatsapp-is-really-going-to-be-the-next-chapter,https://cdn.snapi.dev/images/v1/l/p/image-1065086236-2200314.jpg,"Meta: WhatsApp Is Really Going To Be The Next Chapter (Rating Upgrade)","WhatsApp is a crucial factor for the future of Meta, with the potential to revolutionize its revenue and drive growth in the next few years. WhatsApp's user base continues to grow, with a 15% increase in users compared to last year, and there is still room for further growth, especially in countries like India. Meta's plan to monetize WhatsApp includes click-to-message ads and WhatsApp Pay, which have already shown promising results and have the potential to change the habits of billions of people.","Seeking Alpha","Mon, 18 Dec 2023 10:00:00 -0500",paylimitwall,Positive,Article,META
https://techcrunch.com/2023/12/18/apple-watch-series-9-sales-to-be-halted-over-patent-dispute/,https://cdn.snapi.dev/images/v1/a/p/apple-watch-series-9-05-2200294.jpg,"Apple Watch Series 9 sales to be halted over patent dispute","Apple will be halting sales of its Series 9 smartwatch, TechCrunch has confirmed. The news, shared by 9to5Mac, follows an October ruling by the International Trade Commission (ITC), owing to a patent dispute with California-based med tech firm, Masimo.",TechCrunch,"Mon, 18 Dec 2023 09:58:01 -0500",product,Negative,Article,AAPL
https://www.fool.com/investing/2023/12/18/3-cheap-tech-stocks-to-buy-right-now/,https://cdn.snapi.dev/images/v1/u/r/urlhttps3a2f2fgfoolcdncom2feditorial2fimages2f7584082fworkers-collaborate-about-a-work-issuejpgopresizew400h400-2200259.jpg,"3 Cheap Tech Stocks to Buy Right Now","A venerable tech giant is making a comeback via the cloud. A former semiconductor leader appears to have made some notable technical gains.","The Motley Fool","Mon, 18 Dec 2023 09:48:25 -0500",StocksToWatch,Positive,Article,"IBM,INTC, QCOM"
https://www.zacks.com/stock/news/2199265/retail-sector-poised-for-solid-rebound-in-2024-5-winners,https://cdn.snapi.dev/images/v1/e/p/1047-2200248.jpg,"Retail Sector Poised for Solid Rebound in 2024: 5 Winners","Retail sales are rebounding, which is expected to help stocks like American Eagle Outfitters, (AEO), Amazon.com (AMZN), The Gap (GPS), Casey's General Stores (CASY) and Expedia Group, (EXPE) in the near term.","Zacks Investment Research","Mon, 18 Dec 2023 09:46:28 -0500",NAN,Positive,Article,"AEO,AMZN,CASY,EXPE, GPS"
https://www.zacks.com/stock/news/2166664/3-reasons-why-growth-investors-shouldn-t-overlook-nvidia-nvda,https://cdn.snapi.dev/images/v1/z/y/default18-2105261.jpg,"3 Reasons Why Growth Investors Shouldn't Overlook Nvidia (NVDA)","Nvidia (NVDA) could produce exceptional returns because of its solid growth attributes.","Zacks Investment Research","Mon, 16 Oct 2023 14:17:49 -0400",NAN,Positive,Article,NVDA
https://invezz.com/news/2023/10/16/linkedin-trims-headcount-by-700/?utm_source=snapi,https://cdn.snapi.dev/images/v1/d/o/211820388-m-normal-none-2105230.jpg,"LinkedIn just trimmed its headcount by another 700","Microsoft Corp (NASDAQ: MSFT) is up 2.0% at writing after LinkedIn – the social network for businesses it bought in 2016 laid off nearly 700 of its employees on Monday.",Invezz,"Mon, 16 Oct 2023 13:56:06 -0400",NAN,Negative,Article,MSFT
https://investorplace.com/2023/10/what-to-know-about-the-latest-china-chip-restrictions-as-the-u-s-cracks-down/,https://cdn.snapi.dev/images/v1/i/i/china-chip-restrictions1600-1024x576-2105218.png,"What to Know About the Latest China Chip Restrictions as the U.S. Cracks Down","The stocks of microchip and semiconductor companies are volatile today on reports that the Biden administration is moving to strengthen chip restrictions on China. The administration is closing loopholes that have enabled American chipmakers to skirt current laws and continue selling their products to China.",InvestorPlace,"Mon, 16 Oct 2023 13:46:14 -0400",NAN,Negative,Article,NVDA
https://www.fool.com/investing/2023/10/16/why-intel-broadcom-indie-semi-stocks-popped-today/,https://cdn.snapi.dev/images/v1/t/d/urlhttps3a2f2fgfoolcdncom2feditorial2fimages2f7511522fsemiconductor-computer-chip-with-the-letters-ai-in-the-middlejpgopresizew400h400-2105216.jpg,"Why Intel, Broadcom, and Indie Semi Stocks All Popped Today","Indie Semiconductor issued a bullish forecast for Q3 sales, and the automotive chipmaker looks poised to outperform. Expected new restrictions on Nvidia's chip exports could give Intel and Broadcom some breathing room.","The Motley Fool","Mon, 16 Oct 2023 13:45:13 -0400",NAN,Positive,Article,"AVGO,INTC,INDI"
https://www.fastcompany.com/90967892/linkedin-mass-layoffs-668-employees,https://cdn.snapi.dev/images/v1/p/-/p-1-90967892-linkedin-layoffs-2105331.jpg,"LinkedIn mass layoffs: The jobs platform cuts another 668 employees in its third layoff this year","The company announced it will lay off 3.5% of its workforce, reportedly to prioritize ‘key initiatives' for 2024. LinkedIn is trimming its workforce once again.","Fast Company","Mon, 16 Oct 2023 13:45:00 -0400","paylimitwall",Negative,Article,MSFT
https://investorplace.com/2023/10/meta-stock-is-an-unstoppable-tech-torpedo-for-q4/,https://cdn.snapi.dev/images/v1/j/l/fb-stock-meta-1600-2105219.jpg,"META Stock Is an Unstoppable Tech Torpedo for Q4","Meta Platforms (NASDAQ: META ) isn't just a household name or a metaverse-equipment purveyor. The company is a juggernaut in the fields of social media advertising and generative artificial intelligence ( AI ).",InvestorPlace,"Mon, 16 Oct 2023 13:43:02 -0400",NAN,Positive,Article,META
https://investorplace.com/2023/10/3-ev-stocks-that-can-be-the-next-tesla/,https://cdn.snapi.dev/images/v1/n/x/electric-vehicle-ev-stocks-charging-black-neon-1600-2105220.jpg,"3 EV Stocks That Can Be the Next Tesla","Tesla (NASDAQ: TSLA ) initial public offering happened in June 2010. The offer price was $17 per share and TSLA stock closed the first trading day at $23.9.",InvestorPlace,"Mon, 16 Oct 2023 13:42:13 -0400",NAN,Positive,Article,"LI,RIVN,XPEV"
https://techxplore.com/news/2023-10-linkedin-workers-workforce.html,https://cdn.snapi.dev/images/v1/b/3/linkedin-2105206.jpg,"LinkedIn cuts more than 600 workers, about 3% of workforce","LinkedIn said Monday it is laying off hundreds of employees amounting to about 3% of the social media company's workforce.",TechXplore,"Mon, 16 Oct 2023 13:40:22 -0400",Layoffs,Negative,Article,MSFT
https://www.zacks.com/stock/news/2166626/etfs-in-focus-ahead-of-tesla-q3-earnings,https://cdn.snapi.dev/images/v1/7/j/572-2105188.jpg,"ETFs in Focus Ahead of Tesla Q3 Earnings","Tesla stock has plunged about 13% over the past three months, underperforming the Zacks industry average decline of 8%. The underperformance might reverse if Tesla beats estimates this quarter.","Zacks Investment Research","Mon, 16 Oct 2023 13:32:39 -0400",NAN,Positive,Article,"FDIS,PP,TSLA,TSLL,VCAR, XLY"
https://www.investopedia.com/nvidia-could-be-impacted-by-expanded-us-export-controls-on-ai-chips-to-china-8358382,https://cdn.snapi.dev/images/v1/j/d/inv-nvidiaoffice-gettyimages-1258367321-63d5cf38f6c84d5d93408a077cbcaa0f-2105164.jpg,"Nvidia Could Be Affected by Expanded US Export Controls on AI Chips to China","The Biden administration reportedly will make it harder for Chinese companies to purchase advanced semiconductor chips that can be used in artificial intelligence (AI) applications, putting pressure on AI chipmaker Nvidia (NVDA).",Investopedia,"Mon, 16 Oct 2023 13:25:35 -0400",NAN,Negative,Article,NVDA
https://www.youtube.com/watch?v=tfY-q1dc76g,https://cdn.snapi.dev/images/v1/m/j/tech-earnings-in-focus-as-netflix-and-tesla-report-this-week-2105203.jpg,"Tech earnings in focus as Netflix and Tesla report this week","CNBC's Deirdre Bosa reports on news from the upcoming slate of earnings.","CNBC Television","Mon, 16 Oct 2023 13:21:44 -0400",earnings,Neutral,Video,"NFLX,TSLA"
https://www.investors.com/stock-lists/stocks-near-a-buy-zone/dow-jones-leader-jpmorgan-chip-giant-nvidia-eye-buy-points/,https://cdn.snapi.dev/images/v1/8/j/default17-2086011-2105227.jpg,"Dow Jones Leader JPMorgan, Chip Giant Nvidia Eye Buy Points","Dow Jones banking leader JPMorgan and chip giant Nvidia are approaching new buy points in today's stock market action.","Investors Business Daily","Mon, 16 Oct 2023 13:21:20 -0400",paywall,Positive,Article,"NVDA,JPM"
https://investorplace.com/2023/10/goog-stock-is-alphabet-the-first-quadrillion-dollar-company/,https://cdn.snapi.dev/images/v1/t/o/goog-1600-2105161.jpg,"GOOG Stock: Will Alphabet Be the First Quadrillion-Dollar Company?","Don't look now, but Alphabet's (NASDAQ: GOOG ,NASDAQ: GOOGL ) shares are nearing 52-week highs. That's good news for owners of GOOG stock and technology stocks in general.",InvestorPlace,"Mon, 16 Oct 2023 13:11:24 -0400",NAN,Positive,Article,"GOOG,GOOGL"
https://seekingalpha.com/article/4641059-microsoft-the-potential-of-ai-still-to-gain-full-recognition,https://cdn.snapi.dev/images/v1/u/e/image-1421030803-2105213.jpg,"Microsoft: The Potential Of AI Still To Gain Full Recognition","Microsoft's Dynamics 365 offering, which incorporates AI, can help companies improve communication, access critical data, and reduce workloads and costs. It's no surprise Microsoft is investing in its AI offering. We believe it's a $7 trillion opportunity to say the least. Our state-of-the art DCF model has a $402 target price for MSFT.","Seeking Alpha","Mon, 16 Oct 2023 13:03:06 -0400",paylimitwall,Positive,Article,MSFT
https://www.youtube.com/watch?v=rilFXjx_GVI,https://cdn.snapi.dev/images/v1/m/q/big-tech-earnings-what-to-expect-from-q3-results-2105126.jpg,"Big tech earnings: What to expect from Q3 results","investors will be closely watching third quarter earnings from the big tech companies. Data from Bloomberg Intelligence shows that the big five - Apple (APPL), Microsoft (MSFT), Amazon (AMZN), Nvidia (NVDA), and Alphabet (GOOG,GOOGL) - are expected to show an average 34% year-over-year jump in earnings.","Yahoo Finance","Mon, 16 Oct 2023 12:49:33 -0400",earnings,Positive,Video,"AAPL,AMZN,GOOG,GOOGL,MSFT,NVDA"
https://www.youtube.com/watch?v=891NduS4AFA,https://cdn.snapi.dev/images/v1/m/q/iphone-15-sales-start-off-slow-in-china-2105113.jpg,"IPhone 15 Sales Start Off Slow in China","Sales of Apple's new iPhone 15 in China are down 4.5% compared with the iPhone 14 over their first 17 days after release, according separate studies. Bloomberg's Alex Webb and Ed Ludlow discuss what we know.","Bloomberg Markets and Finance","Mon, 16 Oct 2023 12:45:04 -0400",product,Negative,Video,AAPL
https://www.youtube.com/watch?v=KrZ2Ee3_ln0,https://cdn.snapi.dev/images/v1/n/7/tesla-margins-under-pressure-as-uaw-strike-costing-automakers-each-day-2105075.jpg,"Tesla margins under pressure as UAW strike costing automakers each day","JPMorgan has increased its estimates on how much the United Auto Workers strike will cost Ford (F) and General Motors (GM) per day as the strike continues. The firm has also estimated that the strike already cost both companies over $500 million each.","Yahoo Finance","Mon, 16 Oct 2023 12:22:21 -0400",NAN,Negative,Video,TSLA
https://www.marketbeat.com/originals/costco-dollar-general-target-up-as-market-turns-defensive/?utm_source=snapi,https://cdn.snapi.dev/images/v1/v/l/med-20231016111345-costco-dollar-general-target-up-as-market-turns-de-2105051.jpg,"Costco, Dollar General, Target Up As Market Turns Defensive","Consumer staples stocks were trading higher on October 13 as markets widely anticipated higher interest rates and weakening economic conditions that could boost shares of companies selling essential products like food and toothpaste.",MarketBeat,"Mon, 16 Oct 2023 12:16:08 -0400",NAN,Positive,Article,"COST,DG,TGT"
https://www.youtube.com/watch?v=BXwBZd7RVlg,https://cdn.snapi.dev/images/v1/x/e/tesla-releases-cyberbeer-beverage-2105063.jpg,"Tesla releases CyberBeer beverage","Tesla (TSLA) has released its CyberBeer priced at $150 for two bottles, resembling the Tesla Cybertruck. The beverage has already sold out from Tesla's website on Monday morning.","Yahoo Finance","Mon, 16 Oct 2023 12:15:24 -0400",NAN,Positive,Video,TSLA
https://techcrunch.com/2023/10/16/meta-moderators-talks-collapse/,https://cdn.snapi.dev/images/v1/m/e/meta-distorted-glitched-2105163.jpg,"Meta negotiations with moderators in Kenya over labor dispute collapse,Out of court negotiations between content moderators", "Meta and Sama; the social giant's former content review partner in Africa over a labor dispute before a Kenyan court have collapsed.",TechCrunch,"Mon, 16 Oct 2023 12:12:50 -0400",NAN,Negative,Article,META
https://nypost.com/2023/10/16/linkedin-cutting-more-than-600-jobs-as-demand-for-hiring-services-slows/,https://cdn.snapi.dev/images/v1/2/g/2gfew-2105054.jpg,"LinkedIn cutting more than 600 jobs as demand for hiring services slows","The cuts, which affect more than 3% of the 20,000-strong staff, add to the tens of thousands of job losses this year in the technology sector amid an uncertain economic outlook.","New York Post","Mon, 16 Oct 2023 12:11:35 -0400",Layoffs,Negative,Article,MSFT
https://finbold.com/tesla-stock-is-heavily-under-capitalized-says-financial-analyst/?utm_source=snapi,https://cdn.snapi.dev/images/v1/t/e/tesla-stock-is-heavily-under-capitalized-says-financial-analyst-2059194.jpg,"Tesla stock is ‘heavily under-capitalized,' says financial analyst","As capital markets rebounded from their 2022 bottoms, Tesla‘s (NASDAQ: TSLA) stock has experienced a particularly impressive surge this year, with its share price more than doubling since January 1, 2023.",Finbold,"Tue, 12 Sep 2023 06:26:31 -0400",NAN,Positive,Article,TSLA
https://investorplace.com/2023/09/meta-stock-outlook-why-giving-meta-platforms-365-days-will-pay-off/,https://cdn.snapi.dev/images/v1/2/7/meta1600-2058972.png,"META Stock Outlook: Why Giving Meta Platforms 365 Days Will Pay Off","Week in and week out, Meta Platforms (NASDAQ: META ) stock is constantly in the financial headlines. Sometimes, the news is controversial, but this isn't a reason to give up on META stock.",InvestorPlace,"Tue, 12 Sep 2023 06:25:51 -0400",NAN,Positive,Article,META
https://investorplace.com/2023/09/nvidias-path-to-2-trillion-can-nvda-double-its-market-cap-this-year/,https://cdn.snapi.dev/images/v1/y/i/nvda-1600-2058973.png,"Nvidia's Path to $2 Trillion: Can NVDA Double Its Market Cap This Year?","In May, Nvidia (NASDAQ: NVDA ) briefly reached a $1 trillion market value, propelled by its success in the AI sector, with its stock tripling in less than eight months thanks to the growing interest in generative AI. Given the stock's impressive momentum, many are now considering the potential from here.",InvestorPlace,"Tue, 12 Sep 2023 06:20:57 -0400",NAN,Positive,Article,NVDA
https://www.youtube.com/watch?v=-2acmVoTOBE,https://cdn.snapi.dev/images/v1/m/w/iphone-15-apple-to-sell-made-in-india-iphones-on-launch-day-2058970.jpg,"iPhone 15: Apple to Sell Made-in-India iPhones on Launch Day","As Apple Inc. plans to unveil the new iPhone 15, the model you buy on the launch day could be made in India for the first time ever. Bloomberg Intelligence's Matt Bloxham and Bloomberg's Alex Webb have the details on Bloomberg Television.","Bloomberg Markets and Finance","Tue, 12 Sep 2023 06:12:04 -0400",product,Positive,Video,AAPL
https://www.cnn.com/2023/09/12/tech/apple-iphone-15-event-wonderlust/index.html,https://cdn.snapi.dev/images/v1/j/y/230908170426-apple-wonderlust-iphone-15-event-super-169-2058947.jpg,"Apple is set to unveil the iPhone 15","Apple is expected to debut its iPhone 15 lineup at the company's annual September keynote event on Tuesday, and it could introduce the biggest change to the phone's design in 11 years.","CNN Business","Tue, 12 Sep 2023 06:11:36 -0400",product,Positive,Article,AAPL
https://investorplace.com/2023/09/7-no-brainer-stocks-to-buy-with-1000-right-now/,https://cdn.snapi.dev/images/v1/j/l/stocks-to-buy-greedy1600-1024x576-2058964.png,"7 No-Brainer Stocks to Buy With $1000 Right Now","Finding the best stocks to buy can be tricky. In the stock market, this year has been a beacon for those with a glass-half-full perspective.",InvestorPlace,"Tue, 12 Sep 2023 06:10:45 -0400",StocksToWatch,Positive,Article,"AMD,BYDDF,KO,MDT,META,MSFT,NEE"
https://www.marketwatch.com/story/eight-more-companies-including-nvidia-and-palantir-agree-to-white-house-ai-standards-8a525995,https://cdn.snapi.dev/images/v1/h/a/semi27-2058955.jpg,"Eight more companies including Nvidia and Palantir agree to White House AI standards","The White House on Tuesday said eight more companies — Adobe, Cohere, IBM, Nvidia, Palantir, Salesforce, Scale AI, and Stability — have signed onto their voluntary standards for what they say is safe, secure, and trustworthy development of artificial intelligence technology. Seven companies including Amazon, Google, Meta and Microsoft had agreed to those standards in July.","Market Watch","Tue, 12 Sep 2023 06:09:00 -0400","paylimitwall",Positive,Article,"NVDA,PLTR,ADBE,COHR,CRM,IBM"
https://investorplace.com/2023/09/7-millionaire-maker-ev-stocks-to-hold-through-thick-and-thin/,https://cdn.snapi.dev/images/v1/g/c/evs-1600-1-2058943.png,"7 Millionaire-Maker EV Stocks to Hold Through Thick and Thin","Over the next decade, global leaders want to put millions of electric vehicles on the roads. President Biden, for example, wants 51% of all new autos to be electric by 2030.",InvestorPlace,"Tue, 12 Sep 2023 06:00:44 -0400",NAN,Positive,Article,"ALB,BYDDF,DRIV,EVXX,LAC,TSLA,XPEV"
https://www.businesswire.com/news/home/20230912818287/en/Amazon-Supports-the-World%E2%80%99s-Largest-Deployment-of-Direct-Air-Capture-Technology-to-Remove-Carbon-From-the-Atmosphere/,https://cdn.snapi.dev/images/v1/1/a/press6-2058950.jpg,"Amazon Supports the World's Largest Deployment of Direct Air Capture Technology to Remove Carbon From the Atmosphere","SEATTLE--(BUSINESS WIRE)--Amazon (NASDAQ: AMZN) today announced its first investments in direct air capture (DAC)—a critical technology in the fight against climate change—as part of its Climate Pledge commitment to reach net-zero carbon emissions by 2040. Amazon is supporting the world's largest deployment of DAC technology by committing to purchase 250,000 metric tons of carbon removal over 10 years from STRATOS, 1PointFive's first DAC plant. This is equivalent to the amount of carbon stored.","Business Wire","Tue, 12 Sep 2023 06:00:00 -0400",PressRelease,Neutral,Article,AMZN
https://seekingalpha.com/article/4634536-apple-stock-china-challenges-trouble-or-undeserved-fear,https://cdn.snapi.dev/images/v1/9/0/image-1496169958-2059058.jpg,"Apple: Trouble In Paradise Or Undeserved FUD?","Apple faces challenges in China as the Chinese Communist Party promotes the use of domestic technology and Huawei releases a new phone line. Huawei's Mate 60 Pro is not competitive with Apple's iPhone 15, and Apple products will likely remain dominant in the market. U.S. sanctions hinder Chinese progress in catching up to Apple's technology, making it unlikely that Huawei will reverse its declining market share trend.","Seeking Alpha","Tue, 12 Sep 2023 06:00:00 -0400",paylimitwall,Neutral,Article,AAPL
https://www.fool.com/investing/2023/09/12/unlocking-value-how-teslas-price-reductions-benefi/,https://cdn.snapi.dev/images/v1/w/w/dfde2333-2058910.jpg,"Unlocking Value: How Tesla's Price Reductions Benefit Long-Term Investors","Even with tighter profit margins, Tesla's robust financial strength will likely help it weather turbulent conditions.  If Tesla can sustain record-level sales, it will help the company develop its autonomous-driving software.","The Motley Fool","Tue, 12 Sep 2023 05:52:00 -0400",NAN,Positive,Article,TSLA
https://www.fool.com/investing/2023/09/12/billionaire-investors-loading-up-on-apple-stock/,https://cdn.snapi.dev/images/v1/c/a/app98-2058911.jpg,"Billionaire Investors Are Loading Up on Apple Stock. Should You?","Several billionaire investors have bought Apple stock in the last two quarters. They no doubt like Apple's strong product ecosystem.","The Motley Fool","Tue, 12 Sep 2023 05:52:00 -0400",NAN,Positive,Article,AAPL
https://www.fool.com/investing/2023/09/12/google-sundar-pichai-artificial-intelligence-ai/,https://cdn.snapi.dev/images/v1/t/3/urlhttps3a2f2fgfoolcdncom2feditorial2fimages2f7472852fthe-letters-ai-superimposed-over-a-circuit-boardjpgopresizew400h400-2058885.jpg,"Google CEO Sundar Pichai Says ""Artificial Intelligence (AI) Will Be the Biggest Technological Shift We See in Our Lifetimes. 5 Stocks to Buy and Hold If He's Right.","Alphabet CEO Sundar Pichai believes that AI might be bigger than the internet itself. The AI revolution will not be evenly distributed, with some companies better positioned to profit from the technology.","The Motley Fool","Tue, 12 Sep 2023 05:45:00 -0400","StocksToWatch",Positive,Article,"GOOGL,AMZN,MSFT,NVDA,TSLA,GOOG"
https://www.reuters.com/technology/dutch-groups-sue-google-over-alleged-privacy-violations-2023-09-12/,https://cdn.snapi.dev/images/v1/o/f/lsdzbqvwpfkffhw3c5gebrgtvm-2058883.jpg,"Dutch groups sue Google over alleged privacy violations","The Dutch consumers' association Consumentenbond together with the Privacy Protection Foundation issued legal proceedings against Google on Tuesday for alleged large-scale privacy violations, they said in a statement.",Reuters,"Tue, 12 Sep 2023 05:43:14 -0400",NAN,Negative,Article,"GOOG,GOOGL"
